,tweet_id,text,rating_numerator,rating_denominator,name,rating,date,time,jpg_url,breed_prediction,prediction_confidence,retweet_count,favorite_count,dog_stages
451,794205286408003585,This is Laika. She was a space pupper. The first space pupper actually. Orbited earth like a h*ckin boss. 14/10 hero af https://t.co/trSjgY3h4g,14.0,10.0,Laika,1.4,2016-11-03,15:51:10,https://pbs.twimg.com/media/CwWVe_3WEAAHAvx.jpg,,,3067,8567,pupper
452,793962221541933056,This is Maximus. His face is stuck like that. Tragic really. Great tongue tho. 12/10 would pet firmly https://t.co/xIfrsMNLBR,12.0,10.0,Maximus,1.2,2016-11-02,23:45:19,https://pbs.twimg.com/media/CwS4aqZXUAAe3IO.jpg,Labrador retriever,0.8616510000000001,4509,15548,
453,793845145112371200,This is Clark. He was just caught wearing pants. 13/10 game-changing af https://t.co/2Xo19aPrG5,13.0,10.0,Clark,1.3,2016-11-02,16:00:06,https://pbs.twimg.com/media/CwRN8H6WgAASe4X.jpg,Old English sheepdog,0.7652770000000001,1718,8533,
454,793601777308463104,This is Dobby. I can't stop looking at her feet. 12/10 would absolutely snug https://t.co/LhzPWv6rTv,12.0,10.0,Dobby,1.2,2016-11-01,23:53:02,https://pbs.twimg.com/media/CwNwmxvXEAEJ54Z.jpg,miniature pinscher,0.538981,1501,7395,
455,793500921481273345,This is Fiona. She's an extremely mediocre copilot. Very distracting. Wink makes up for all the missed turns. 12/10 https://t.co/aF5MmpvPqN,12.0,10.0,Fiona,1.2,2016-11-01,17:12:16,https://pbs.twimg.com/media/CwMU34YWIAAz1nU.jpg,golden retriever,0.326122,2194,9873,
456,793286476301799424,This is Moreton. He's the Good Boy Who Lived. 13/10 magical as h*ck https://t.co/rLHGx3VAF3,13.0,10.0,Moreton,1.3,2016-11-01,03:00:09,https://pbs.twimg.com/media/CwJR1okWIAA6XMp.jpg,Afghan hound,0.274637,8455,22774,
457,793271401113350145,Meet Dave. It's his favorite day of the year. He gets to fulfill his dream of being a dinosaur. 12/10 inspirational af https://t.co/MgQSdfZGPN,12.0,10.0,Dave,1.2,2016-11-01,02:00:14,https://pbs.twimg.com/media/CwJEIKTWYAAvL-T.jpg,Siberian husky,0.231695,2222,8041,
458,793256262322548741,Oh h*ck look at this spookling right here. Fright level off the charts. 12/10 sufficiently spooked https://t.co/BNy9IIJMb0,12.0,10.0,,1.2,2016-11-01,01:00:05,https://pbs.twimg.com/media/CwI2XCvXEAEO8mc.jpg,basset,0.207622,7664,18505,
459,793241302385262592,This is Tucker. He's out here bustin h*ckin ghosts. 13/10 dedicated af https://t.co/Ap477GhwXt,13.0,10.0,Tucker,1.3,2016-11-01,00:00:38,https://pbs.twimg.com/media/CwIougTWcAAMLyq.jpg,golden retriever,0.559308,3029,9736,
460,793226087023144960,"This is Juno. She spooked me up real good, but only to get my attention. Above average handwriting for a dog I think. 11/10 https://t.co/hFxxBCWlwj",11.0,10.0,Juno,1.1,2016-10-31,23:00:11,https://pbs.twimg.com/media/CwIa5CjW8AErZgL.jpg,wire-haired fox terrier,0.456047,2681,9084,
461,793210959003287553,This is Maude. She's the h*ckin happiest wasp you've ever seen. 10/10 would pet with caution https://t.co/etL8FHBrh8,10.0,10.0,Maude,1.0,2016-10-31,22:00:04,https://pbs.twimg.com/media/CwINKJeW8AYHVkn.jpg,French bulldog,0.0187591,2572,8264,
462,793195938047070209,Say hello to Lily. She's pupset that her costume doesn't fit as well as last year. 12/10 poor puppo https://t.co/YSi6K1firY,12.0,10.0,Lily,1.2,2016-10-31,21:00:23,https://pbs.twimg.com/media/CwH_foYWgAEvTyI.jpg,Labrador retriever,0.654762,5205,14135,puppo
463,793180763617361921,This is Newt. He's a strawberry. 11/10 https://t.co/2VhmlwxA1Q,11.0,10.0,Newt,1.1,2016-10-31,20:00:05,https://pbs.twimg.com/media/CwHxsdYVMAAqGCJ.jpg,Lakeland terrier,0.266824,1837,6409,
464,793165685325201412,This is Benji. He's Air Bud. It's a low effort costume but he pulls it off rather h*ckin well. 12/10 would happily get dunked on https://t.co/IbzT7DJvBo,12.0,10.0,Benji,1.2,2016-10-31,19:00:10,https://pbs.twimg.com/media/CwHj-jGWAAAnsny.jpg,golden retriever,0.946224,2595,8693,
465,793150605191548928,This is Nida. She's a free elf. Waited so long for this day. 11/10 https://t.co/3lE8Izgmkf,11.0,10.0,Nida,1.1,2016-10-31,18:00:14,https://pbs.twimg.com/media/CwHWOZ7W8AAHv8S.jpg,Italian greyhound,0.193869,1568,5697,
466,793135492858580992,Your favorite squad is looking extra h*ckin spooky today. 13/10 for all https://t.co/PrgvOyPtDT,13.0,10.0,,1.3,2016-10-31,17:00:11,https://pbs.twimg.com/media/CwHIg61WIAApnEV.jpg,,,2308,5955,
467,793120401413079041,"This is Robin. She's desperately trying to do me a frighten, but her tongue drastically decreases her spook value. Still 11/10 great effort https://t.co/sxMrsOZ8zb",11.0,10.0,Robin,1.1,2016-10-31,16:00:13,https://pbs.twimg.com/media/CwG6zDfWcAA8jBD.jpg,Labrador retriever,0.7249439999999999,3617,11753,
468,792913359805018113,Here is a perfect example of someone who has their priorities in order. 13/10 for both owner and Forrest https://t.co/LRyMrU7Wfq,13.0,10.0,,1.3,2016-10-31,02:17:31,https://pbs.twimg.com/media/CwD-eCLWIAA6v0B.jpg,,,3652,13283,
469,792883833364439040,This is Bailey. She's rather h*ckin hype for Halloween tomorrow. Carved those pupkins herself. 12/10 https://t.co/v17mFm0Ftz,12.0,10.0,Bailey,1.2,2016-10-31,00:20:11,https://pbs.twimg.com/media/CwDjoH3WAAIniIs.jpg,standard poodle,8.31451e-05,3936,10447,
470,792773781206999040,This is Monster. Not an actual monster tho. He's showing you his tongue. Very impressive Monster. 12/10 would snug https://t.co/RhaPExuxJL,12.0,10.0,Monster,1.2,2016-10-30,17:02:53,https://pbs.twimg.com/media/CwB_i-zXEAEiP29.jpg,Yorkshire terrier,0.912804,1552,6830,
471,792394556390137856,Meet BeBe. She rocks the messy bun of your dreams. H*ckin flawless. 12/10 would watch her tutorial https://t.co/of0pFNBIl8,12.0,10.0,BeBe,1.2,2016-10-29,15:55:58,https://pbs.twimg.com/media/Cv8moW9W8AIHOxR.jpg,cocker spaniel,0.746387,3958,12418,
472,792050063153438720,This is Remus. He's a mop that came to life. Can't see anything. Constantly trips over himself. Still a very good dog. 11/10 https://t.co/S3f1SYylzu,11.0,10.0,Remus,1.1,2016-10-28,17:07:05,https://pbs.twimg.com/media/Cv3tU38WcAASFas.jpg,komondor,0.942856,1646,6609,
473,791672322847637504,When she says you're a good boy and you know you're a good boy because you're a good boy. 13/10 https://t.co/O5IUmRHRIh,13.0,10.0,,1.3,2016-10-27,16:06:04,https://pbs.twimg.com/media/CvyVxQRWEAAdSZS.jpg,golden retriever,0.705092,2870,10857,
474,791406955684368384,Say hello to Levi. He's a Madagascan Butterbop. One of the more docile Butterbops I've seen. 12/10 would give all the pets https://t.co/Zcw9Sccctc,12.0,10.0,Levi,1.2,2016-10-26,22:31:36,https://pbs.twimg.com/media/CvukbEkWAAAV-69.jpg,Pembroke,0.972629,3799,12189,
475,791312159183634433,This is Mabel. She's super h*ckin smol. Portable af. Comes with the smol shoe. 12/10 would keep in frocket https://t.co/GGJvxYt3xK,12.0,10.0,Mabel,1.2,2016-10-26,16:14:55,https://pbs.twimg.com/media/CvtONV4WAAAQ3Rn.jpg,miniature pinscher,0.892925,2327,8110,
476,790987426131050500,This is Misty. She has a cowboy hat on her nose. 12/10 https://t.co/Eno0mypHIr,12.0,10.0,Misty,1.2,2016-10-25,18:44:32,https://pbs.twimg.com/media/Cvom3ZJXEAE29TD.jpg,cocker spaniel,0.349195,1958,9080,
477,790946055508652032,This is Betty. She's assisting with the dishes. Such a good puppo. 12/10 h*ckin helpful af https://t.co/dgvTPZ9tgI,12.0,10.0,Betty,1.2,2016-10-25,16:00:09,https://pbs.twimg.com/media/CvoBPWRWgAA4het.jpg,golden retriever,0.245773,4311,15478,puppo
478,790698755171364864,This is Mosby. He appears to be rather h*ckin snuggable af. 12/10 keep it up Mosby https://t.co/IiiBq460I7,12.0,10.0,Mosby,1.2,2016-10-24,23:37:28,https://pbs.twimg.com/media/CvkgUjbUsAEvo7l.jpg,Bernese mountain dog,0.996541,1776,7619,
479,790581949425475584,This is Duke. He sneaks into the fridge sometimes. It's his safe place. 11/10 would give little jacket if necessary https://t.co/Fd5WFDTMH4,11.0,10.0,Duke,1.1,2016-10-24,15:53:19,https://pbs.twimg.com/media/Cvi2FiKWgAAif1u.jpg,malinois,0.000152999,6546,19155,
480,790337589677002753,Meet Maggie. She can hear your cells divide. 12/10 can also probably fly https://t.co/ovE2hqXryV,12.0,10.0,Maggie,1.2,2016-10-23,23:42:19,https://pbs.twimg.com/media/CvfX2AnWYAAQTay.jpg,Pembroke,0.658808,1743,7241,
481,790277117346975746,This is Bruce. He never backs down from a challenge. 11/10 you got this Bruce https://t.co/aI7umZHIq7,11.0,10.0,Bruce,1.1,2016-10-23,19:42:02,https://pbs.twimg.com/media/Cveg1-NXgAASaaT.jpg,Labrador retriever,0.427742,2916,11591,
482,789986466051088384,This is Happy. He's a bathtub reviewer. Seems to be pleased with this one. 12/10 https://t.co/Ln89R4FP7v,12.0,10.0,Happy,1.2,2016-10-23,00:27:05,https://pbs.twimg.com/media/CvaYgDOWgAEfjls.jpg,golden retriever,0.07853049999999999,2110,8608,
483,789628658055020548,This is Eli. He can fly. 13/10 magical af https://t.co/huPSJJ7FDI,13.0,10.0,Eli,1.3,2016-10-22,00:45:17,https://pbs.twimg.com/media/CvVTEnPXYAAWLyL.jpg,chow,0.260702,1612,6919,
484,789599242079838210,This is Brownie. She's wearing a Halloween themed onesie. 12/10 festive af https://t.co/0R4meWXFOx,12.0,10.0,Brownie,1.2,2016-10-21,22:48:24,https://pbs.twimg.com/media/CvU4UZpXgAE1pAV.jpg,Chesapeake Bay retriever,0.8788219999999999,1762,6244,
485,789530877013393408,This is Rizzy. She smiles a lot. 12/10 contagious af https://t.co/TU4sZogVIq,12.0,10.0,Rizzy,1.2,2016-10-21,18:16:44,https://pbs.twimg.com/media/CvT6IV6WEAQhhV5.jpg,schipperke,0.363272,3117,10838,
486,789268448748703744,This is Stella. She's happier than I will ever be. 10/10 would trade lives with https://t.co/JSs2bfDtTS,10.0,10.0,Stella,1.0,2016-10-21,00:53:56,https://pbs.twimg.com/media/CvQLdotWcAAZn86.jpg,malamute,0.81286,2409,8461,
487,789137962068021249,This is Bo. He's a West Congolese Bugaboop Snuggle. Rather exotic. Master of the head tilt. 12/10 would pay to pet https://t.co/2jwxxtNzoN,12.0,10.0,Bo,1.2,2016-10-20,16:15:26,https://pbs.twimg.com/media/CvOUw8vWYAAzJDq.jpg,Chihuahua,0.746135,2568,9003,
488,788908386943430656,"This is Lucy. She destroyed not one, but two remotes trying to turn off the debate. 11/10 relatable af https://t.co/3BXh073tDm",11.0,10.0,Lucy,1.1,2016-10-20,01:03:11,https://pbs.twimg.com/media/CvLD-mbWYAAFI8w.jpg,golden retriever,0.0340897,11495,25401,
489,788765914992902144,This is Butter. She can have whatever she wants forever. 12/10 would hug softly https://t.co/x5gXRS1abq,12.0,10.0,Butter,1.2,2016-10-19,15:37:03,https://pbs.twimg.com/media/CvJCabcWgAIoUxW.jpg,cocker spaniel,0.500509,9515,25316,
490,788412144018661376,This is Dexter. He breaks hearts for a living. 11/10 h*ckin handsome af https://t.co/4DhSsC1W7S,11.0,10.0,Dexter,1.1,2016-10-18,16:11:17,https://pbs.twimg.com/media/CvEAqQoWgAADj5K.jpg,golden retriever,0.805238,4861,14408,
491,788178268662984705,Atlas is back and this time he's got doggles. Still 13/10 solarly conscious af https://t.co/s7MgFWDySc,13.0,10.0,,1.3,2016-10-18,00:41:57,https://pbs.twimg.com/media/CvAr88kW8AEKNAO.jpg,Samoyed,0.73548,1953,6744,
492,788150585577050112,This is Leo. He's a golden chow. Rather h*ckin rare. 13/10 would give extra pats https://t.co/xosHjFzVXc,13.0,10.0,Leo,1.3,2016-10-17,22:51:57,https://pbs.twimg.com/media/CvASw6dWcAQmo3X.jpg,chow,0.814145,1185,5687,
493,788039637453406209,Did... did they pick out that license plate? 12/10 for both https://t.co/lRmUUOxgbQ,12.0,10.0,,1.2,2016-10-17,15:31:05,https://pbs.twimg.com/media/Cu-t20yWEAAFHXi.jpg,,,1206,5654,
494,787810552592695296,This is Frank. He wears sunglasses and walks himself. 11/10 I'll never be this cool or independent https://t.co/pNNjBtHWPc,11.0,10.0,Frank,1.1,2016-10-17,00:20:47,https://pbs.twimg.com/media/Cu7dg2RXYAIaGXE.jpg,pug,0.362835,2798,7967,
495,787717603741622272,This is Tonks. She is a service puppo. Can hear a caterpillar hiccup from 7 miles away. 13/10 would follow anywhere https://t.co/i622ZbWkUp,13.0,10.0,Tonks,1.3,2016-10-16,18:11:26,https://pbs.twimg.com/media/Cu6I9vvWIAAZG0a.jpg,German shepherd,0.992339,2539,9465,puppo
496,787397959788929025,This is Moose. He's rather h*ckin dangerous (you can tell by the collar). 11/10 would still attempt to snug https://t.co/lHVHGdDzb3,11.0,10.0,Moose,1.1,2016-10-15,21:01:17,https://pbs.twimg.com/media/Cu1mQsDWEAAU_VQ.jpg,Chihuahua,0.900483,2623,10065,
497,787322443945877504,This is Lincoln. He forgot to use his blinker when he changed lanes just now. Guilty as h*ck. Still 10/10 https://t.co/lsrR83SiVp,10.0,10.0,Lincoln,1.0,2016-10-15,16:01:13,https://pbs.twimg.com/media/Cu0hlfwWYAEdnXO.jpg,golden retriever,0.105703,1607,7217,
498,786963064373534720,This is Rory. He's got an interview in a few minutes. Looking spiffy af. Nervous as h*ck tho. 12/10 would hire https://t.co/ibj5g6xaAj,12.0,10.0,Rory,1.2,2016-10-14,16:13:10,https://pbs.twimg.com/media/Cuvau3MW8AAxaRv.jpg,golden retriever,0.915303,7303,24637,
499,786709082849828864,"This is Logan, the Chow who lived. He solemnly swears he's up to lots of good. H*ckin magical af 9.75/10 https://t.co/yBO5wuqaPS",75.0,10.0,Logan,7.5,2016-10-13,23:23:56,https://pbs.twimg.com/media/CurzvFTXgAA2_AP.jpg,Pomeranian,0.467321,5628,16933,
500,786664955043049472,"""Honestly Kathleen I just want more Ken Bone"" 12/10 https://t.co/HmlEvAMP4r",12.0,10.0,,1.2,2016-10-13,20:28:35,https://pbs.twimg.com/media/CurLmoqXgAEPoJ-.jpg,Leonberg,0.512034,2328,9831,
501,786595970293370880,This is Dale. He's a real spookster. Did me quite the frighten. 11/10 not too spooky to pet tho https://t.co/L8BWDD4oBX,11.0,10.0,Dale,1.1,2016-10-13,15:54:28,https://pbs.twimg.com/media/CuqM0fVWAAAboKR.jpg,Pembroke,0.709512,2872,8748,
502,786363235746385920,This is Rizzo. He has many talents. A true renaissance doggo. 13/10 entertaining af https://t.co/TVXpEJB7Wn,13.0,10.0,Rizzo,1.3,2016-10-13,00:29:39,https://pbs.twimg.com/media/Cum5LlfWAAAyPcS.jpg,golden retriever,0.929266,3167,10051,doggo
503,786233965241827333,This is Mattie. She's extremely dangerous. Will bite your h*ckin finger right off. Still 11/10 would pet with caution https://t.co/78c9W8kLFh,11.0,10.0,Mattie,1.1,2016-10-12,15:55:59,https://pbs.twimg.com/media/CulDnZpWcAAGbZ-.jpg,Labrador retriever,0.478193,4303,14044,
504,785927819176054784,This is Lucy. She's strives to be the best potato she can be. 12/10 would boop https://t.co/lntsj7Fc4Y,12.0,10.0,Lucy,1.2,2016-10-11,19:39:28,https://pbs.twimg.com/media/CugtKeXWEAAamDZ.jpg,toy poodle,0.00849262,2933,10518,
505,785872687017132033,Meet Rusty. He appears to be rather h*ckin fluffy. Also downright adorable af. 12/10 would rub my face against his https://t.co/1j9kLGb4wV,12.0,10.0,Rusty,1.2,2016-10-11,16:00:24,https://pbs.twimg.com/ext_tw_video_thumb/785872596088811520/pu/img/5O-_BgqdFQu_2Bt7.jpg,Great Pyrenees,0.392108,1648,6176,
506,785639753186217984,This is Pinot. He's a sophisticated doggo. You can tell by the hat. Also pointier than your average pupper. Still 10/10 would pet cautiously https://t.co/f2wmLZTPHd,10.0,10.0,Pinot,1.0,2016-10-11,00:34:48,https://pbs.twimg.com/media/CucnLmeWAAALOSC.jpg,,,2079,7247,"doggo, pupper"
507,785533386513321988,This is Dallas. Her tongue is ridiculous. 11/10 h*ckin proud af https://t.co/h4jhlH4EyG,11.0,10.0,Dallas,1.1,2016-10-10,17:32:08,https://pbs.twimg.com/media/CubGchjXEAA6gpw.jpg,miniature pinscher,0.436023,1809,8356,
508,785264754247995392,This is Doc. He requested to be carried around like that. 12/10 anything for Doc https://t.co/mWYACm4qnx,12.0,10.0,Doc,1.2,2016-10-09,23:44:41,https://pbs.twimg.com/media/CuXSHNnWcAIWEwn.jpg,chow,0.056137,1495,6760,
509,785170936622350336,This is Hero. He was enjoying the car ride until he remembered that bees are dying globally at an alarming rate. 11/10 https://t.co/cubFg7F4qQ,11.0,10.0,Hero,1.1,2016-10-09,17:31:53,https://pbs.twimg.com/media/CuV8yfxXEAAUlye.jpg,Eskimo dog,0.0274944,4417,11110,
510,784826020293709826,This is Rusty. He's going D1 for sure. Insane vertical. 13/10 would draft https://t.co/AsykOwMrXQ,13.0,10.0,Rusty,1.3,2016-10-08,18:41:19,https://pbs.twimg.com/media/CuRDF-XWcAIZSer.jpg,chow,0.0903414,2959,9357,
511,784517518371221505,This is Frankie. He has yet to learn how to control his tongue. 11/10 maybe one day https://t.co/p6fgYe2dB6,11.0,10.0,Frankie,1.1,2016-10-07,22:15:26,https://pbs.twimg.com/media/CuMqhGrXYAQwRqU.jpg,malamute,0.757764,2324,8317,
512,784431430411685888,This is Stormy. He's curly af. Already pupared for Coachella next year. 12/10 https://t.co/PHA1vtqqpt,12.0,10.0,Stormy,1.2,2016-10-07,16:33:21,https://pbs.twimg.com/media/CuLcNkCXgAEIwK2.jpg,miniature poodle,0.744819,1163,5317,
513,783839966405230592,This is Riley. His owner put a donut pillow around him and he loves it so much he won't let anyone take it off. 13/10 https://t.co/8TCQcsZCZ8,13.0,10.0,Riley,1.3,2016-10-06,01:23:05,https://pbs.twimg.com/media/CuDCSM-XEAAJw1W.jpg,,,9859,27706,
514,783821107061198850,This is Mairi. She has mastered the art of camouflage. 12/10 h*ckin sneaky af https://t.co/STcPjiNAHp,12.0,10.0,Mairi,1.2,2016-10-06,00:08:09,https://pbs.twimg.com/media/CuCxIzyWEAQTnQA.jpg,Lakeland terrier,0.26565900000000003,1800,6828,
515,783695101801398276,This is Loomis. He's the leader of the Kenneth search party. The passion is almost overwhelming. 12/10 one day he will be free https://t.co/kCRKlFg4AY,12.0,10.0,Loomis,1.2,2016-10-05,15:47:27,https://pbs.twimg.com/media/CuA-iRHXYAAWP8e.jpg,chow,0.314265,2943,9643,
516,783466772167098368,This is Finn. He likes eavesdropping from filing cabinets. It's a real issue but no one has approached him about it. 11/10 would still pet https://t.co/s8W8Del9HQ,11.0,10.0,Finn,1.1,2016-10-05,00:40:09,https://pbs.twimg.com/media/Ct9u3ljW8AEnVIm.jpg,Chihuahua,0.789,2050,7775,
517,783391753726550016,Meet Godi. He's an avid beachgoer and part time rainbow summoner. Eyeliner flawless af. 13/10 would snug well https://t.co/BO936YdJdi,13.0,10.0,Godi,1.3,2016-10-04,19:42:03,https://pbs.twimg.com/media/Ct8qn8EWIAAk9zP.jpg,Norwegian elkhound,0.87713,5024,15635,
518,783334639985389568,This is Dave. He's currently in a predicament. Doesn't seem to mind tho. 12/10 someone assist Dave https://t.co/nfprKAXqwu,12.0,10.0,Dave,1.2,2016-10-04,15:55:06,https://pbs.twimg.com/media/Ct72q9jWcAAhlnw.jpg,Cardigan,0.593858,10700,26897,
519,783085703974514689,This is Earl. He can't catch. Did his best tho. 11/10 would repair confidence with extra pats https://t.co/IsqyvbjFgM,11.0,10.0,Earl,1.1,2016-10-03,23:25:55,https://pbs.twimg.com/media/Ct4URfWUAAQ7lKe.jpg,Chesapeake Bay retriever,0.240602,1989,7547,
520,782969140009107456,This is Cali. She arrived preassembled. Convenient af. 12/10 appears to be rather h*ckin pettable https://t.co/vOBV1ZqVcX,12.0,10.0,Cali,1.2,2016-10-03,15:42:44,https://pbs.twimg.com/media/Ct2qO5PXEAE6eB0.jpg,golden retriever,0.17139300000000002,6761,22279,
521,782747134529531904,This is Deacon. He's the happiest almost dry doggo I've ever seen. 11/10 would smile back https://t.co/C6fUMnHt1H,11.0,10.0,Deacon,1.1,2016-10-03,01:00:34,https://pbs.twimg.com/media/CtzgXgeXYAA1Gxw.jpg,golden retriever,0.560699,1291,6906,doggo
522,782722598790725632,"This is Penny. She fought a bee and the bee won. 10/10 you're fine Penny, everything's fine https://t.co/zrMVdfFej6",10.0,10.0,Penny,1.0,2016-10-02,23:23:04,https://pbs.twimg.com/media/CtzKC7zXEAALfSo.jpg,Irish setter,0.574557,4939,15914,
523,782598640137187329,This is Timmy. He's quite large. According to a trusted source it's actually a dog wearing a dog suit. 11/10 https://t.co/BIUchFwHqn,11.0,10.0,Timmy,1.1,2016-10-02,15:10:30,https://pbs.twimg.com/media/CtxZTtxUMAEduGo.jpg,malamute,0.8408709999999999,1747,7207,
524,782305867769217024,This is Sampson. He just graduated. Ready to be a doggo now. Time for the real world. 12/10 have fun with taxes https://t.co/pgVKxRw0s1,12.0,10.0,Sampson,1.2,2016-10-01,19:47:08,https://pbs.twimg.com/media/CttPBt0WIAAcsDE.jpg,briard,0.5044270000000001,5053,15355,doggo
525,781955203444699136,This is Chipson. He weighed in at .3 ounces and is officially super h*ckin smol. Space-saving af. 11/10 would snug delicately https://t.co/FjEsk7A1JV,11.0,10.0,Chipson,1.1,2016-09-30,20:33:43,https://pbs.twimg.com/media/CtoQGu4XgAQgv5m.jpg,,,3085,10312,
526,781661882474196992,Who keeps sending in pictures without dogs in them? This needs to stop. 5/10 for the mediocre road https://t.co/ELqelxWMrC,5.0,10.0,,0.5,2016-09-30,01:08:10,https://pbs.twimg.com/media/CtkFS72WcAAiUrs.jpg,Pembroke,0.438087,2479,9640,
527,781524693396357120,Idk why this keeps happening. We only rate dogs. Not Bangladeshi Couch Chipmunks. Please only send dogs... 12/10 https://t.co/ya7bviQUUf,12.0,10.0,,1.2,2016-09-29,16:03:01,https://pbs.twimg.com/media/CtiIj0AWcAEBDvw.jpg,Chesapeake Bay retriever,0.0035225,5057,19107,
528,781251288990355457,This is Oakley. He just got yelled at for going 46 in a 45. Churlish af. 11/10 would still pet so well https://t.co/xIYsa6LPA4,11.0,10.0,Oakley,1.1,2016-09-28,21:56:36,https://pbs.twimg.com/media/CteP5H5WcAEhdLO.jpg,Mexican hairless,0.8877709999999999,1902,7712,
529,781163403222056960,"We normally don't rate lobsters, but this one appears to be a really good lobster. 10/10 would pet with caution https://t.co/YkHc7U7uUy",10.0,10.0,,1.0,2016-09-28,16:07:23,https://pbs.twimg.com/media/Ctc_-BTWEAAQpZh.jpg,Shetland sheepdog,0.973841,2540,9020,
530,780931614150983680,I want to finally rate this iconic puppo who thinks the parade is all for him. 13/10 would absolutely attend https://t.co/5dUYOu4b8d,13.0,10.0,,1.3,2016-09-28,00:46:20,https://pbs.twimg.com/media/CtZtJxAXEAAyPGd.jpg,,,6613,19968,puppo
531,780858289093574656,"This is Dash. He's very stylish, but also incredibly unimpressed with the current state of our nation. 10/10 would pet ears first https://t.co/YElO4hvXI6",10.0,10.0,Dash,1.0,2016-09-27,19:54:58,https://pbs.twimg.com/media/CtYqeNHWgAATqYZ.jpg,Chesapeake Bay retriever,0.488555,1837,6611,
532,780800785462489090,This is Koda. He has a weird relationship with tall grass. Slightly concerning. 11/10 would def still pet https://t.co/KQzSR8eCsw,11.0,10.0,Koda,1.1,2016-09-27,16:06:28,https://pbs.twimg.com/media/CtX2Kr9XYAAuxrM.jpg,Siberian husky,0.951963,1183,5053,
533,780601303617732608,Meet Hercules. He can have whatever he wants for the rest of eternity. 12/10 would snug passionately https://t.co/mH0IOyFdIG,12.0,10.0,Hercules,1.2,2016-09-27,02:53:48,https://pbs.twimg.com/media/CtVAvX-WIAAcGTf.jpg,Saint Bernard,0.995143,3076,11107,
534,780543529827336192,Here's a perturbed super floof. 12/10 would snug so damn well https://t.co/VG095mi09Q,12.0,10.0,,1.2,2016-09-26,23:04:13,https://pbs.twimg.com/media/CtUMLzRXgAAbZK5.jpg,golden retriever,0.628312,1604,5833,
535,780459368902959104,"This is Bear. Don't worry, he's not a real bear tho. Contains unreal amounts of squish. 11/10 heteroskedastic af https://t.co/coi4l1T2Sm",11.0,10.0,Bear,1.1,2016-09-26,17:29:48,https://pbs.twimg.com/media/CtS_p9kXEAE2nh8.jpg,Great Dane,0.382491,986,4878,
536,780192070812196864,We only rate dogs. Pls stop sending in non-canines like this Urban Floof Giraffe. I can't handle this. 11/10 https://t.co/zHIqpM5Gni,11.0,10.0,,1.1,2016-09-25,23:47:39,https://pbs.twimg.com/media/CtPMhwvXYAIt6NG.jpg,vizsla,0.144012,2051,8016,
537,779834332596887552,This is Scout. He really wants to kiss himself. H*ckin inappropriate. 11/10 narcissistic af https://t.co/x0gV2Ck3AD,11.0,10.0,Scout,1.1,2016-09-25,00:06:08,https://pbs.twimg.com/media/CtKHLuCWYAA2TTs.jpg,golden retriever,0.99383,6401,17335,
538,779377524342161408,Have you ever seen such a smol pupper? Portable af. 12/10 would keep in shirt pocket https://t.co/KsqaIzlQ12,12.0,10.0,,1.2,2016-09-23,17:50:56,https://pbs.twimg.com/ext_tw_video_thumb/779377444025499652/pu/img/eIiLDy9F6rPNarEc.jpg,,,2839,8056,pupper
539,779056095788752897,Everybody drop what you're doing and look at this dog. 13/10 must be super h*ckin rare https://t.co/I1bJUzUEW5,13.0,10.0,,1.3,2016-09-22,20:33:42,https://pbs.twimg.com/media/Cs_DYr1XEAA54Pu.jpg,Chihuahua,0.721188,4150,13577,
540,778990705243029504,This is Jay. He's really h*ckin happy about the start of fall. Sneaky tongue slip in 2nd pic. 11/10 snuggly af https://t.co/vyx1X5eyWI,11.0,10.0,Jay,1.1,2016-09-22,16:13:51,https://pbs.twimg.com/media/Cs-H5uhWcAAiNY9.jpg,cocker spaniel,0.7153510000000001,6565,18357,
541,778748913645780993,"This is Mya (pronounced ""mmmyah?""). Her head is round af. 11/10 would pat accordingly https://t.co/1dpEuALnY0",11.0,10.0,Mya,1.1,2016-09-22,00:13:04,https://pbs.twimg.com/media/Cs6r_-kVIAALh1p.jpg,Staffordshire bullterrier,0.351434,1186,6302,
542,778650543019483137,"Meet Strider. He thinks he's a sorority girl. Already wants to go to NYC for a weekend to say he's ""studied abroad"" 10/10 https://t.co/KYZkPuiC1l",10.0,10.0,Strider,1.0,2016-09-21,17:42:10,https://pbs.twimg.com/media/Cs5ShihWEAAH2ti.jpg,German shepherd,0.515699,1371,5287,
543,778624900596654080,This is Penny. She's a sailor pup. 11/10 would take to the open seas with https://t.co/0rRxyBQt32,11.0,10.0,Penny,1.1,2016-09-21,16:00:17,https://pbs.twimg.com/media/Cs47N3eWcAEmgiW.jpg,Airedale,0.786089,927,4237,
544,778408200802557953,RIP Loki. Thank you for the good times. You will be missed by many. 14/10 https://t.co/gJKD9pst5A,14.0,10.0,,1.4,2016-09-21,01:39:11,https://pbs.twimg.com/media/Cs12ICuWAAECNRy.jpg,Pembroke,0.8483620000000001,3953,12598,
545,778383385161035776,This is Nala. She's a future Dogue model. Won't respond to my texts. 13/10 would be an honor to pet https://t.co/zP1IvAATWv,13.0,10.0,Nala,1.3,2016-09-21,00:00:35,https://pbs.twimg.com/media/Cs1fjyqWIAE2jop.jpg,collie,0.345266,1003,5369,
546,778286810187399168,This is Stanley. He has too much skin. Isn't happy about it. Quite pupset actually. Still 11/10 would comfort https://t.co/hhTfnPrWfb,11.0,10.0,Stanley,1.1,2016-09-20,17:36:50,https://pbs.twimg.com/media/Cs0HuUTWcAUpSE8.jpg,Boston bull,0.32207,3009,9503,
547,778039087836069888,Evolution of a pupper yawn featuring Max. 12/10 groundbreaking stuff https://t.co/t8Y4x9DmVD,12.0,10.0,,1.2,2016-09-20,01:12:28,https://pbs.twimg.com/media/CswmaHmWAAAbdY9.jpg,German shepherd,0.717776,2417,7827,pupper
