,tweet_id,text,rating_numerator,rating_denominator,name,rating,date,time,jpg_url,breed_prediction,prediction_confidence,retweet_count,favorite_count,dog_stages
935,714251586676113411,This is Thumas. He hates potted plants. 8/10 wtf Thumas https://t.co/rDVueNIcEi,8.0,10.0,Thumas,0.8,2016-03-28,00:43:43,https://pbs.twimg.com/media/CemIBt4WwAQqhVV.jpg,soft-coated wheaten terrier,0.751962,752,2964,
936,714214115368108032,Happy Easter from the squad! ðŸ‡ðŸ¶ 13/10 for all https://t.co/YMx4KWJUAB,13.0,10.0,,1.3,2016-03-27,22:14:49,https://pbs.twimg.com/media/Cell8ikWIAACCJ-.jpg,pug,0.533967,788,2078,
937,714141408463036416,"I know we only rate dogs, but since it's Easter I guess we could rate a bunny for a change. 10/10 petable as hell https://t.co/O2RlKXigHu",10.0,10.0,,1.0,2016-03-27,17:25:54,https://pbs.twimg.com/media/Cekj0qwXEAAHcS6.jpg,Labrador retriever,0.586951,1254,3907,
938,713919462244790272,This is Kanu. He's a Freckled Ticonderoga. Simply flawless. 12/10 would perform an elaborate heist to capture https://t.co/7vyAzIURrE,12.0,10.0,Kanu,1.2,2016-03-27,02:43:58,https://pbs.twimg.com/media/CehZ9mLWsAAsn28.jpg,Siberian husky,0.463223,707,2974,
939,713900603437621249,Happy Saturday here's 9 puppers on a bench. 99/90 good work everybody https://t.co/mpvaVxKmc1,99.0,90.0,,1.1,2016-03-27,01:29:02,https://pbs.twimg.com/media/CehIzzZWQAEyHH5.jpg,golden retriever,0.371816,646,2558,
940,713761197720473600,This is Piper. She would really like that tennis ball core. Super sneaky tongue slip. 12/10 precious af https://t.co/QP6GHi5az9,12.0,10.0,Piper,1.2,2016-03-26,16:15:05,https://pbs.twimg.com/media/CefKBOuWIAAIlKD.jpg,Brittany spaniel,0.797936,1220,4375,
941,713411074226274305,Here we see an extremely rare Bearded Floofmallow. Only a few left in the wild. 11/10 would pet with a purpose https://t.co/jVJJKlPbvq,11.0,10.0,,1.1,2016-03-25,17:03:49,https://pbs.twimg.com/media/CeaLlAPUMAIcC7U.jpg,Great Pyrenees,0.720337,1164,4011,
942,713177543487135744,This is Lance. Lance doesn't give a shit. 10/10 we should all be more like Lance https://t.co/SqnG9Ap28J,10.0,10.0,Lance,1.0,2016-03-25,01:35:51,https://pbs.twimg.com/media/CeW3MWMWQAEOMbq.jpg,whippet,0.734244,2561,6505,
943,713175907180089344,Say hello to Opie and Clarkus. Clarkus fell asleep so Opie buried him. Ruthless af 10/10 for both https://t.co/xT7XaY4gnW,10.0,10.0,Opie,1.0,2016-03-25,01:29:21,https://pbs.twimg.com/media/CeW1tERWAAAA9Q2.jpg,malamute,0.430624,1315,4003,
944,712809025985978368,This is Stubert. He just arrived. 10/10 https://t.co/HVGs5aAKAn,10.0,10.0,Stubert,1.0,2016-03-24,01:11:29,https://pbs.twimg.com/media/CeRoBaxWEAABi0X.jpg,Labrador retriever,0.8686709999999999,5991,17191,
945,712717840512598017,Please don't send in any more polar bears. We only rate dogs. Thank you... 10/10 https://t.co/83RGhdIQz2,10.0,10.0,,1.0,2016-03-23,19:09:09,https://pbs.twimg.com/media/CeQVF1eVIAAJaTv.jpg,Great Pyrenees,0.732043,4449,11099,
946,712668654853337088,Say hello to Sunny and Roxy. They pull things out of water together. 10/10 for both https://t.co/88aedAmxcl,10.0,10.0,Sunny,1.0,2016-03-23,15:53:42,https://pbs.twimg.com/media/CePoVTyWsAQEz1g.jpg,Labrador retriever,0.829058,1087,3754,
947,712438159032893441,This is Kane. He's a semi-submerged Haitian Huffleplop. Happy af. Sick waterfall. 11/10 would pat head approvingly https://t.co/7zjEC501Ul,11.0,10.0,Kane,1.1,2016-03-23,00:37:48,https://pbs.twimg.com/media/CeMWubMWwAA6GwF.jpg,Great Pyrenees,0.069457,1398,4788,
948,712097430750289920,I can't even comprehend how confused this dog must be right now. 10/10 https://t.co/8AGcQ4hIfK,10.0,10.0,,1.0,2016-03-22,02:03:52,https://pbs.twimg.com/media/CeHg1klW8AE4YOB.jpg,Labrador retriever,0.720481,917,3385,
949,712092745624633345,This is Steven. He's inverted af. Also very helpful. Scans anything you want for free. Takes him a while tho. 7/10 https://t.co/tA0ZiQ7JcG,7.0,10.0,Steven,0.7,2016-03-22,01:45:15,https://pbs.twimg.com/media/CeHckpuW4AAF7rT.jpg,,,793,2647,
950,712085617388212225,"Say hello to Olive and Ruby. They are best buddies. Both 11/10 
1 like = 1 buddy https://t.co/yagmFdKlyL",11.0,10.0,Olive,1.1,2016-03-22,01:16:55,https://pbs.twimg.com/media/CeHWFksXIAAyypp.jpg,Shih-Tzu,0.625129,430,2948,
951,712065007010385924,This is Chester. He's clearly in charge of the other dogs. Weird ass paws. Not fit for fetch. 6/10 would still pet https://t.co/o2GvskrhHt,6.0,10.0,Chester,0.6,2016-03-21,23:55:01,https://pbs.twimg.com/media/CeHDV73W0AM5Cf8.jpg,,,561,2033,
952,711968124745228288,Meet Winston. He's trapped in a cup of coffee. Poor pupper. 10/10 someone free him https://t.co/2e6cUtKUuc,10.0,10.0,Winston,1.0,2016-03-21,17:30:03,https://pbs.twimg.com/media/CeFrO3qXEAADRbd.jpg,,,2055,7250,pupper
953,711743778164514816,Meet Roosevelt. He's calculating the best case scenario if he drops out instead of doing math hw. 11/10 relatable af https://t.co/QcSIRDpfVg,11.0,10.0,Roosevelt,1.1,2016-03-21,02:38:34,https://pbs.twimg.com/media/CeCfMPDW0AAAEUj.jpg,Lakeland terrier,0.459515,892,2557,
954,711732680602345472,I want to hear the joke this dog was just told. 10/10 https://t.co/1KiuZqqOD4,10.0,10.0,,1.0,2016-03-21,01:54:29,https://pbs.twimg.com/media/CeCVGEbUYAASeY4.jpg,Ibizan hound,0.334929,3638,7930,
955,711694788429553666,Oh. My. God. 13/10 magical af https://t.co/Ezu6jQrKAZ,13.0,10.0,,1.3,2016-03-20,23:23:54,https://pbs.twimg.com/tweet_video_thumb/CeBym7oXEAEWbEg.jpg,,,16384,29695,
956,711652651650457602,This is Gary. He just wanted to say hi. 9/10 very personable pup https://t.co/Sk3CbhmKSW,9.0,10.0,Gary,0.9,2016-03-20,20:36:28,https://pbs.twimg.com/media/CeBMT6-WIAA7Qqf.jpg,,,811,3472,
957,711363825979756544,"""Please, no puparazzi"" 11/10 https://t.co/nJIXSPfedK",11.0,10.0,,1.1,2016-03-20,01:28:47,https://pbs.twimg.com/media/Cd9Fn5QUMAAYMT4.jpg,Pembroke,0.7509060000000001,1006,3255,
958,711306686208872448,What hooligan sent in pictures w/out a dog in them? Churlish af. 3/10 just bc that's a neat fluffy bean bag chair https://t.co/wcwoGOkZvz,3.0,10.0,,0.3,2016-03-19,21:41:44,https://pbs.twimg.com/media/Cd8Rpl0W0AAN1kU.jpg,Dandie Dinmont,0.0867925,665,2989,
959,711008018775851008,This is Chuckles. He had a balloon but he accidentally let go of it and it floated away. 11/10 hang in there pupper https://t.co/68iNM7B5gW,11.0,10.0,Chuckles,1.1,2016-03-19,01:54:56,https://pbs.twimg.com/media/Cd4CBQFW8AAY3ND.jpg,French bulldog,0.731405,551,2677,pupper
960,710997087345876993,Meet Milo and Amos. They are the best of pals. Both 12/10 would pet at the same time https://t.co/Mv37BHEyyD,12.0,10.0,Milo,1.2,2016-03-19,01:11:29,https://pbs.twimg.com/media/Cd34FClUMAAnvGP.jpg,malamute,0.28126,1244,4118,
961,710844581445812225,This is Staniel. His selfie game is strong af. 10/10 I'd snapchat with Staniel https://t.co/UgkTw7TKyM,10.0,10.0,Staniel,1.0,2016-03-18,15:05:29,https://pbs.twimg.com/media/Cd1tYGmXIAAoW5b.jpg,Pembroke,0.200407,603,2306,
962,710833117892898816,Say hello to Sora. She's an Egyptian Pumpernickel. Mesmerizing af. 12/10 would bring home to mom https://t.co/PmTR4kxZkq,12.0,10.0,Sora,1.2,2016-03-18,14:19:56,https://pbs.twimg.com/media/Cd1i8qvUkAE-Jlr.jpg,Pembroke,0.803742,467,2416,
963,710658690886586372,Here's a brigade of puppers. All look very prepared for whatever happens next. 80/80 https://t.co/0eb7R1Om12,80.0,80.0,,1.0,2016-03-18,02:46:49,https://pbs.twimg.com/media/CdzETn4W4AAVU5N.jpg,soft-coated wheaten terrier,0.948617,510,2092,
964,710588934686908417,This is Beemo. He's a Chubberflop mix. 12/10 would cross the world for https://t.co/kzMVMU8HBV,12.0,10.0,Beemo,1.2,2016-03-17,22:09:38,https://pbs.twimg.com/media/CdyE2x1W8AAe0TG.jpg,Pembroke,0.982004,1671,4103,
965,710283270106132480,This is Gunner. He's a Figamus Newton. King of the peek-a-boo. Cool jeans. 11/10 https://t.co/ONuBILIYXZ,11.0,10.0,Gunner,1.1,2016-03-17,01:55:02,https://pbs.twimg.com/media/Cdtu3WRUkAAsRVx.jpg,Shih-Tzu,0.932401,472,1941,
966,710272297844797440,We ðŸ‘ðŸ» only ðŸ‘ðŸ» rate ðŸ‘ðŸ» dogs. Pls stop sending in non-canines like this Dutch Panda Worm. This is infuriating. 11/10 https://t.co/odfLzBonG2,11.0,10.0,,1.1,2016-03-17,01:11:26,https://pbs.twimg.com/media/Cdtk414WoAIUG0v.jpg,Old English sheepdog,0.586307,1117,4052,
967,710269109699739648,"The squad is back for St. Patrick's Day! â˜˜ ðŸ’š
13/10 for all https://t.co/OcCDb2bng5",13.0,10.0,,1.3,2016-03-17,00:58:46,https://pbs.twimg.com/media/Cdth_KyWEAEXH3u.jpg,pug,0.415495,998,2149,
968,710153181850935296,This is Lacy. She's tipping her hat to you. Daydreams of her life back on the frontier. 11/10 would pet so well https://t.co/fG5Pk3Et1I,11.0,10.0,Lacy,1.1,2016-03-16,17:18:07,https://pbs.twimg.com/media/Cdr4jO2UAAAIo6W.jpg,cocker spaniel,0.00271296,795,2634,
969,710140971284037632,This is Tater. His underbite is fierce af. Doesn't give a damn about your engagement photo. 8/10 https://t.co/nLuPY3pY12,8.0,10.0,Tater,0.8,2016-03-16,16:29:35,https://pbs.twimg.com/media/Cdrtcr-W4AAqi5H.jpg,Pekinese,0.95317,791,2469,
970,710117014656950272,This pupper got her hair chalked for her birthday. Hasn't told her parents yet. Rebellious af. 11/10 very nifty https://t.co/h1OX2mLtxV,11.0,10.0,,1.1,2016-03-16,14:54:24,https://pbs.twimg.com/media/CdrXp9dWoAAcRfn.jpg,toy poodle,0.802092,1764,4933,pupper
971,709918798883774466,Meet Watson. He's a Suzuki Tickleboop. Leader of a notorious biker gang. Only one ear functional. 12/10 snuggable af https://t.co/R1gLc5vDqG,12.0,10.0,Watson,1.2,2016-03-16,01:46:45,https://pbs.twimg.com/media/CdojYQmW8AApv4h.jpg,Pembroke,0.956222,974,3143,
972,709901256215666688,"WeRateDogs stickers are here and they're 12/10! Use code ""puppers"" at checkout ðŸ¶ðŸ¾

Shop now: https://t.co/k5xsufRKYm https://t.co/ShXk46V13r",12.0,10.0,,1.2,2016-03-16,00:37:03,https://pbs.twimg.com/media/CdoTbL_XIAAitq2.jpg,,,91,597,
973,709852847387627521,*lets out a tiny whimper and then collapses* ...12/10 https://t.co/BNdVZEHRow,12.0,10.0,,1.2,2016-03-15,21:24:41,https://pbs.twimg.com/media/CdnnZhhWAAEAoUc.jpg,Chihuahua,0.945629,1074,3169,
974,709566166965075968,This is Olaf. He's gotta be rare. Seems sturdy. Tail is floofy af. 12/10 would do whatever it takes to pet https://t.co/E9jaU59bh9,12.0,10.0,Olaf,1.2,2016-03-15,02:25:31,https://pbs.twimg.com/media/Cdjiqi6XIAIUOg-.jpg,chow,0.999837,1054,3180,
975,709556954897764353,This is Cecil. She's a Gigglefloof Poofer. Outdoorsy af. One with nature. 12/10 would strategically capture https://t.co/ijJB0DuOIC,12.0,10.0,Cecil,1.2,2016-03-15,01:48:55,https://pbs.twimg.com/media/CdjaSFCWAAAJZh3.jpg,golden retriever,0.790026,966,2943,
976,709519240576036864,This is Vince. He's a Gregorian Flapjeck. White spot on legs almost looks like another dog (whoa). 9/10 rad as hell https://t.co/aczGAV2dK4,9.0,10.0,Vince,0.9,2016-03-14,23:19:03,https://pbs.twimg.com/media/Cdi3-f7W8AUOm9T.jpg,cocker spaniel,0.414982,216,1352,
977,709449600415961088,Meet Karma. She's just a head. Lost body during the Second Punic War (unfortunate). Loves to travel 10/10 petable af https://t.co/c6af6nYEPo,10.0,10.0,Karma,1.0,2016-03-14,18:42:20,https://pbs.twimg.com/media/Cdh4pgAW0AEKJ_a.jpg,Maltese dog,0.780187,510,1978,
978,709409458133323776,This is Billy. He sensed a squirrel. 8/10 damn it Billy https://t.co/Yu0K98VZ9A,8.0,10.0,Billy,0.8,2016-03-14,16:02:49,https://pbs.twimg.com/media/CdhUIMSUIAA4wYK.jpg,Shetland sheepdog,0.79745,605,2385,
979,709225125749587968,This is Walker. He's a Butternut Khalifa. Appears fuzzy af. 11/10 would hug for a ridiculous amount of time https://t.co/k6fEWHSALn,11.0,10.0,Walker,1.1,2016-03-14,03:50:21,https://pbs.twimg.com/media/Cdese-zWEAArIqE.jpg,Labrador retriever,0.271109,516,2156,
980,709207347839836162,This is Penny. She's trying on her prom dress. Stunning af 11/10 https://t.co/qcZDZGCapg,11.0,10.0,Penny,1.1,2016-03-14,02:39:42,https://pbs.twimg.com/media/CdecUSzUIAAHCvg.jpg,Chihuahua,0.948323,5110,11238,
981,709198395643068416,"From left to right:
Cletus, Jerome, Alejandro, Burp, &amp; Titson
None know where camera is. 45/50 would hug all at once https://t.co/sedre1ivTK",45.0,50.0,,0.9,2016-03-14,02:04:08,https://pbs.twimg.com/media/CdeUKpcWoAAJAWJ.jpg,borzoi,0.490783,578,2214,
982,709158332880297985,Meet Rodney. He's a Ukranian Boomchicka. Outside but would like to be inside. Only has one ear (unfortunate) 10/10 https://t.co/FjAj3ggXrR,10.0,10.0,Rodney,1.0,2016-03-13,23:24:56,https://pbs.twimg.com/media/CddvvSwWoAUObQw.jpg,Siberian husky,0.212957,359,1833,
983,709042156699303936,This is Klevin. He's addicted to sandwiches (yes a hotdog is a sandwich fight me) It's tearing his family apart 9/10 https://t.co/7BkkVNu5pd,9.0,10.0,Klevin,0.9,2016-03-13,15:43:18,https://pbs.twimg.com/media/CdcGBB3WwAAGBuU.jpg,Rottweiler,0.0681793,1458,4229,
984,708845821941387268,Here's a pupper with magic eyes. Not wearing a seat belt tho (irresponsible af). Very distracting to driver. 9/10 https://t.co/5DLJB4ssvI,9.0,10.0,,0.9,2016-03-13,02:43:08,https://pbs.twimg.com/media/CdZTgynWwAATZcx.jpg,schipperke,0.74564,795,2700,pupper
985,708834316713893888,Meet Malikai. He was rolling around having fun when he remembered the inevitable heat death of the universe. 10/10 https://t.co/Vd2FqHIIGn,10.0,10.0,Malikai,1.0,2016-03-13,01:57:25,https://pbs.twimg.com/media/CdZI_bpWEAAm1fs.jpg,Eskimo dog,0.283945,444,1506,
986,708810915978854401,This is Mister. He's a wonderful father to his two pups. Heartwarming af. 10/10 for all https://t.co/2KcuJXL2r4,10.0,10.0,Mister,1.0,2016-03-13,00:24:26,https://pbs.twimg.com/media/CdYzwuYUIAAHPkB.jpg,golden retriever,0.976139,6178,14903,
987,708738143638450176,This is Coco. She gets to stay on the Bachelor for another week. Super pumped 11/10 https://t.co/wsCB6LFNxD,11.0,10.0,Coco,1.1,2016-03-12,19:35:15,https://pbs.twimg.com/media/CdXxlFPWwAABaOv.jpg,Pomeranian,0.933457,728,2486,
988,708711088997666817,This is Smokey. He really likes tennis balls. 11/10 https://t.co/Ah7WlYTUBQ,11.0,10.0,Smokey,1.1,2016-03-12,17:47:45,https://pbs.twimg.com/media/CdXY-GHWoAALing.jpg,German short-haired pointer,0.0526946,631,2297,
989,708479650088034305,Meet Bear. He's a Beneboop Cumberclap. Extremely unamused. 13/10 I'm in love with this picture https://t.co/uC8kUqAz0W,13.0,10.0,Bear,1.3,2016-03-12,02:28:06,https://pbs.twimg.com/media/CdUGcLMWAAI42q0.jpg,Shih-Tzu,0.218479,610,2296,
990,708469915515297792,This is Bobble. He's a Croatian Galifianakis. Hears everything within 400 miles. 11/10 would snug diligently https://t.co/VwDc6PTDzk,11.0,10.0,Bobble,1.1,2016-03-12,01:49:25,https://pbs.twimg.com/media/CdT9n7mW0AQcpZU.jpg,Chihuahua,0.748163,720,2769,
991,708356463048204288,This is Oliver. That is his castle. He protects it with his life. He's also squishy af. 10/10 would squish softly https://t.co/oSuEGw0BhX,10.0,10.0,Oliver,1.0,2016-03-11,18:18:36,https://pbs.twimg.com/media/CdSWcc1XIAAXc6H.jpg,pug,0.871283,1179,3237,
992,708349470027751425,This is River. He's changing the trumpet game. Innovative af. 11/10 such a good boy https://t.co/tK7a0AxQfd,11.0,10.0,River,1.1,2016-03-11,17:50:48,https://pbs.twimg.com/media/CdSQFWOWAAApgfq.jpg,basenji,0.187158,668,2145,
993,708149363256774660,This is Jebberson. He's the reigning hide and seek world champion. 10/10 hasn't lost his touch https://t.co/VEFkvWCoHF,10.0,10.0,Jebberson,1.0,2016-03-11,04:35:39,https://pbs.twimg.com/media/CdPaEkHW8AA-Wom.jpg,Cardigan,0.350993,1390,3905,
994,708130923141795840,Please stop sending in non canines like this Guatemalan Twiggle Bunny. We only rate dogs. Only send in dogs... 11/10 https://t.co/XKhobeGuvT,11.0,10.0,,1.1,2016-03-11,03:22:23,https://pbs.twimg.com/media/CdPJUWIWIAAIchl.jpg,French bulldog,0.710354,771,3037,
995,708119489313951744,This is Cooper. He basks in the glory of rebellion. 9/10 probably a preteen https://t.co/kDamUfeIpm,9.0,10.0,Cooper,0.9,2016-03-11,02:36:57,https://pbs.twimg.com/media/CdO-6x5W8AENSBJ.jpg,Norwich terrier,0.264483,872,2426,
996,708109389455101952,This is Remington. He was caught off guard by the magical floating cheese. Spooked af. 10/10 deep breaths pup https://t.co/mhPSADiJmZ,10.0,10.0,Remington,1.0,2016-03-11,01:56:49,https://pbs.twimg.com/media/CdO1u9vWAAApj2V.jpg,Staffordshire bullterrier,0.5161060000000001,494,1763,
997,708026248782585858,Everybody stop what you're doing and watch this video. Frank is stuck in a loop. 13/10 (Vid by @klbmatty) https://t.co/5AJs8TIV1U,13.0,10.0,,1.3,2016-03-10,20:26:26,https://pbs.twimg.com/ext_tw_video_thumb/708026062568087553/pu/img/rNhylAwIfb6YthGu.jpg,malinois,0.7864680000000001,1727,3996,
998,707995814724026368,This is Farfle. He lost his back legs during the Battle of Gettysburg. Goes 0-60 in 4.3 seconds (damn) 12/10 hero af https://t.co/NiQQWzIzzq,12.0,10.0,Farfle,1.2,2016-03-10,18:25:30,https://pbs.twimg.com/media/CdNOb17WwAA5z4A.jpg,,,991,2804,
999,707969809498152960,Meet Rufus. He's a Honeysuckle Firefox. Curly af. Badass tie. About to go on his first date ever 11/10 good luck pup https://t.co/dGoTWNfIsm,11.0,10.0,Rufus,1.1,2016-03-10,16:42:10,https://pbs.twimg.com/media/CdM2xRpXEAUsR4k.jpg,toy poodle,0.908491,856,2435,
1000,707776935007539200,This is Sadie. She's a Bohemian Rhapsody. Remarkably portable. Could sneak on roller coasters with (probably). 11/10 https://t.co/DB8fyeDs8B,11.0,10.0,Sadie,1.1,2016-03-10,03:55:45,https://pbs.twimg.com/media/CdKHWimWoAABs08.jpg,miniature pinscher,0.890426,857,2949,
1001,707741517457260545,When your roommate eats your leftover Chili's but you pretend it's no big deal cuz you fat anyway. 10/10 head up pup https://t.co/0nMgoue8IR,10.0,10.0,,1.0,2016-03-10,01:35:01,https://pbs.twimg.com/media/CdJnJ1dUEAARNcf.jpg,whippet,0.738371,547,2241,
1002,707693576495472641,This is Jiminus. He's in a tub for some reason. What a jokester. Smh 7/10 churlish af https://t.co/84L4ED9Tpi,7.0,10.0,Jiminus,0.7,2016-03-09,22:24:31,https://pbs.twimg.com/media/CdI7jDnW0AA2dtO.jpg,,,904,3055,
1003,707610948723478529,This is Harper. She scraped her elbow attempting a backflip off a tree. Valiant effort tho. 12/10 https://t.co/oHKJHghrp5,12.0,10.0,Harper,1.2,2016-03-09,16:56:11,https://pbs.twimg.com/media/CdHwZd0VIAA4792.jpg,golden retriever,0.383223,5635,15306,
1004,707420581654872064,This is Keurig. He's a rare dog. Laughs like an idiot tho. Head is basically a weapon. Poorly maintained goatee 4/10 https://t.co/xOrUyj7K30,4.0,10.0,Keurig,0.4,2016-03-09,04:19:44,https://pbs.twimg.com/media/CdFDQVgWIAArslx.jpg,kuvasz,0.149391,615,2028,
1005,707411934438625280,"""I shall trip the big pupper with leash. Big pupper will never see it coming. I am a genius."" Both 11/10 https://t.co/uQsCJ8pf51",11.0,10.0,,1.1,2016-03-09,03:45:22,https://pbs.twimg.com/media/CdE7ZktXIAEiWLj.jpg,Lakeland terrier,0.7382770000000001,535,2074,pupper
1006,707387676719185920,Meet Clarkus. He's a Skinny Eastern Worcestershire. Can tie own shoes (impressive af) 10/10 would put on track team https://t.co/XP5o7zGn0E,10.0,10.0,Clarkus,1.0,2016-03-09,02:08:59,https://pbs.twimg.com/media/CdElVm7XEAADP6o.jpg,Chihuahua,0.888468,1124,3143,
1007,707377100785885184,This dog just brutally murdered a snowman. Currently toying with its nutritious remains 9/10 would totally still pet https://t.co/iKThgKnW1j,9.0,10.0,,0.9,2016-03-09,01:26:57,https://pbs.twimg.com/media/CdEbt0NXIAQH3Aa.jpg,golden retriever,0.637225,964,2945,
1008,707315916783140866,This is Finnegus. He's trapped in a snow globe. Poor pupper. 10/10 would make sure no one shook it https://t.co/BjpOa52jQ4,10.0,10.0,Finnegus,1.0,2016-03-08,21:23:50,https://pbs.twimg.com/media/CdDkEkHWwAAAeUJ.jpg,Bernese mountain dog,0.979235,566,2240,pupper
1009,707297311098011648,This is Cassie. She can go from sweet to scary af in a matter of seconds. 10/10 points deducted for cats on pajamas https://t.co/B6dmZmJBdK,10.0,10.0,Cassie,1.0,2016-03-08,20:09:54,https://pbs.twimg.com/media/CdDTJLMW4AEST--.jpg,Blenheim spaniel,0.370717,699,2517,
1010,707059547140169728,Say hello to Cupcake. She's an Icelandic Dippen Dot. Confused by the oddly geometric lawn pattern. 11/10 https://t.co/D7rorf4YKL,11.0,10.0,Cupcake,1.1,2016-03-08,04:25:07,https://pbs.twimg.com/media/Cc_64zVWEAAeXs7.jpg,Samoyed,0.8973120000000001,611,2354,
1011,707038192327901184,This is Kathmandu. He sees every move you make. Probably knows Jiu-Jitsu. 10/10 mysterious af https://t.co/z0cs7E4Xjj,10.0,10.0,Kathmandu,1.0,2016-03-08,03:00:15,https://pbs.twimg.com/media/Cc_ney1W4AANuY3.jpg,pug,0.642426,703,1979,
1012,707021089608753152,This is Tucker. He's a Dasani Episcopalian. Good lord what a tongue. 12/10 would never let go of https://t.co/gHtW5cgyy7,12.0,10.0,Tucker,1.2,2016-03-08,01:52:18,https://pbs.twimg.com/media/Cc_XtkRW8AEE7Fn.jpg,cocker spaniel,0.559658,1210,3656,
1013,707014260413456384,This is Ellie. She requests to be carried around in a lacrosse stick at all times. 11/10 impossible to say no https://t.co/15yCmd43zU,11.0,10.0,Ellie,1.1,2016-03-08,01:25:10,https://pbs.twimg.com/media/Cc_RsVlXEAIzzlX.jpg,Chihuahua,0.58378,535,2069,
1014,706901761596989440,This is Elliot. He's blocking the roadway. Downright rude as hell. Doesn't care that you're already late. 3/10 https://t.co/FMUxir5pYu,3.0,10.0,Elliot,0.3,2016-03-07,17:58:08,https://pbs.twimg.com/media/Cc9rZlBWwAA56Ra.jpg,,,512,1849,
1015,706681918348251136,Say hello to Katie. She's a Mitsubishi Hufflepuff. Curly af. 12/10 I'd do terrible things to acquire such a pup https://t.co/CFPIcGcwJv,12.0,10.0,Katie,1.2,2016-03-07,03:24:33,https://pbs.twimg.com/media/Cc6jcYRXIAAFuox.jpg,toy poodle,0.717584,882,2965,
1016,706644897839910912,Meet Shadow. She's tired of the responsibilities associated with being a dog. No longer strives to attain ball. 9/10 https://t.co/cdOkfEpjFw,9.0,10.0,Shadow,0.9,2016-03-07,00:57:27,https://pbs.twimg.com/ext_tw_video_thumb/706644797256241152/pu/img/NTqvmIUQExGmKFSR.jpg,Chihuahua,0.132928,964,2307,
1017,706593038911545345,Here's a sneak peek of me on spring break. 10/10 so many tired pups these days https://t.co/6aJrjKfNqX,10.0,10.0,,1.0,2016-03-06,21:31:22,https://pbs.twimg.com/media/Cc5Snc7XIAAMidF.jpg,,,570,1943,
1018,706538006853918722,"This is Oliver (pronounced ""Ricardo""). He's a ship captain. Controls these treacherous waters. 11/10 would sail with https://t.co/bxjO45rXKd",11.0,10.0,Oliver,1.1,2016-03-06,17:52:42,https://pbs.twimg.com/media/Cc4gjxqW4AIoThO.jpg,chow,0.541794,1270,3130,
1019,706516534877929472,Please enjoy this pup in a cooler. Permanently ready for someone to throw a tennis ball his way. 12/10 https://t.co/KUS0xl7XIp,12.0,10.0,,1.2,2016-03-06,16:27:23,https://pbs.twimg.com/media/Cc4NCQiXEAEx2eJ.jpg,golden retriever,0.7726850000000001,919,2834,
1020,706346369204748288,This is Koda. She's a Beneboom Cumberwiggle. 12/10 petable as hell https://t.co/VZV6oMJmU6,12.0,10.0,Koda,1.2,2016-03-06,05:11:12,https://pbs.twimg.com/media/Cc1yRE2WoAAgxFQ.jpg,Tibetan mastiff,0.956462,826,3095,
1021,706310011488698368,Here's a very sleepy pupper. Thinks it's an airplane. 12/10 would snug for eternity https://t.co/GGmcTIkBbf,12.0,10.0,,1.2,2016-03-06,02:46:44,https://pbs.twimg.com/media/Cc1RNHLW4AACG6H.jpg,Pembroke,0.6981649999999999,7020,19155,pupper
1022,706291001778950144,When you're just relaxin and having a swell time but then remember you have to fill out the FAFSA ...11/10 https://t.co/qy33OBcexg,11.0,10.0,,1.1,2016-03-06,01:31:11,https://pbs.twimg.com/media/Cc0_2tXXEAA2iTY.jpg,Border terrier,0.587101,428,1534,
1023,706265994973601792,"This is Kara. She's been trying to solve that thing for 3 days. ""I don't have thumbs,"" she said. 11/10 solid effort https://t.co/lA6a8GefrV",11.0,10.0,Kara,1.1,2016-03-05,23:51:49,https://pbs.twimg.com/media/Cc0pLU0WAAEfGEw.jpg,papillon,0.743715,832,2460,
1024,706166467411222528,This is Dexter. He's a shy pup. Doesn't bark much. Dreadful fetcher. Has rare sun allergy. 7/10 still petable https://t.co/sA7P3JSqiv,7.0,10.0,Dexter,0.7,2016-03-05,17:16:20,https://pbs.twimg.com/media/CczOp_OWoAAo5zR.jpg,Samoyed,0.430418,1427,4637,
1025,705975130514706432,This is Adele. Her tongue flies out of her mouth at random. It's a debilitating illness. 10/10 stay strong pupper https://t.co/cfn81n3FLO,10.0,10.0,Adele,1.0,2016-03-05,04:36:02,https://pbs.twimg.com/media/CcwgjmuXIAEQoSd.jpg,Staffordshire bullterrier,0.5877640000000001,652,2805,pupper
1026,705970349788291072,This is Lucy. She's a Venetian Kerploof. Supposed to be navigating. Quite irresponsible. Fancy ass collar tho 12/10 https://t.co/8tjnz1L8DI,12.0,10.0,Lucy,1.2,2016-03-05,04:17:02,https://pbs.twimg.com/media/CcwcSS9WwAALE4f.jpg,golden retriever,0.776346,786,2865,
1027,705898680587526145,Meet Max. He's a Fallopian Cephalopuff. Eyes are magical af. Lil dandruff problem. No big deal 10/10 would still pet https://t.co/c67nUjwmFs,10.0,10.0,Max,1.0,2016-03-04,23:32:15,https://pbs.twimg.com/media/CcvbGj5W8AARjB6.jpg,collie,0.808276,487,2133,
1028,705786532653883392,"Seriously, add us ðŸ¶ 11/10 for sad wet pupper https://t.co/xwPE9faVZR",11.0,10.0,,1.1,2016-03-04,16:06:36,https://pbs.twimg.com/media/Cct1G6vVAAI9ZjF.jpg,Labrador retriever,0.14849600000000002,461,1766,pupper
1029,705591895322394625,"""Ma'am, for the last time, I'm not authorized to make that type of transaction"" 11/10 https://t.co/nPTBsdm3BF",11.0,10.0,,1.1,2016-03-04,03:13:11,https://pbs.twimg.com/media/CcrEFQdUcAA7CJf.jpg,basenji,0.877207,1010,2837,
1030,705475953783398401,Say hello to Zara. She found a sandal and couldn't be happier. 12/10 great work https://t.co/zQUuVu812n,12.0,10.0,Zara,1.2,2016-03-03,19:32:29,https://pbs.twimg.com/media/CcpaoR9WAAAKlJJ.jpg,golden retriever,0.908784,809,2679,
1031,705442520700944385,This is Cooper. He only wakes up to switch gears. 12/10 helpful af https://t.co/EEIkAGVY64,12.0,10.0,Cooper,1.2,2016-03-03,17:19:38,https://pbs.twimg.com/media/Cco8OmOXIAE0aCu.jpg,Great Pyrenees,0.309106,1435,3991,
