,tweet_id,text,rating_numerator,rating_denominator,name,rating,date,time,jpg_url,breed_prediction,prediction_confidence,retweet_count,favorite_count,dog_stages
0,892420643555336193,This is Phineas. He's a mystical boy. Only ever appears in the hole of a donut. 13/10 https://t.co/MgUWQ76dJU,13.0,10.0,Phineas,1.3,2017-08-01,16:23:56,https://pbs.twimg.com/media/DGKD1-bXoAAIAUK.jpg,,,6890,32957,
1,892177421306343426,"This is Tilly. She's just checking pup on you. Hopes you're doing ok. If not, she's available for pats, snugs, boops, the whole bit. 13/10 https://t.co/0Xxu71qeIV",13.0,10.0,Tilly,1.3,2017-08-01,00:17:27,https://pbs.twimg.com/media/DGGmoV4XsAAUL6n.jpg,Chihuahua,0.323581,5193,28501,
2,891815181378084864,This is Archie. He is a rare Norwegian Pouncing Corgo. Lives in the tall grass. You never know when one may strike. 12/10 https://t.co/wUnZnhtVJB,12.0,10.0,Archie,1.2,2017-07-31,00:18:03,https://pbs.twimg.com/media/DGBdLU1WsAANxJ9.jpg,Chihuahua,0.716012,3426,21430,
3,891689557279858688,This is Darla. She commenced a snooze mid meal. 13/10 happens to the best of us https://t.co/tD36da7qLQ,13.0,10.0,Darla,1.3,2017-07-30,15:58:51,https://pbs.twimg.com/media/DF_q7IAWsAEuuN8.jpg,Labrador retriever,0.168086,7102,35962,
4,891327558926688256,"This is Franklin. He would like you to stop calling him ""cute."" He is a very fierce shark and should be respected as such. 12/10 #BarkWeek https://t.co/AtUZn91f7f",12.0,10.0,Franklin,1.2,2017-07-29,16:00:24,https://pbs.twimg.com/media/DF6hr6BUMAAzZgT.jpg,basset,0.555712,7620,34381,
5,891087950875897856,Here we have a majestic great white breaching off South Africa's coast. Absolutely h*ckin breathtaking. 13/10 (IG: tucker_marlo) #BarkWeek https://t.co/kQ04fDDRmh,13.0,10.0,,1.3,2017-07-29,00:08:17,https://pbs.twimg.com/media/DF3HwyEWsAABqE6.jpg,Chesapeake Bay retriever,0.425595,2552,17310,
6,890971913173991426,"Meet Jax. He enjoys ice cream so much he gets nervous around it. 13/10 help Jax enjoy more things by clicking below

https://t.co/Zr4hWfAs1H https://t.co/tVJBRMnhxl",13.0,10.0,Jax,1.3,2017-07-28,16:27:12,https://pbs.twimg.com/media/DF1eOmZXUAALUcq.jpg,Appenzeller,0.34170300000000003,1622,10096,
7,890729181411237888,When you watch your owner call another dog a good boy but then they turn back to you and say you're a great boy. 13/10 https://t.co/v0nONBcwxq,13.0,10.0,,1.3,2017-07-28,00:22:40,https://pbs.twimg.com/media/DFyBahAVwAAhUTd.jpg,Pomeranian,0.566142,15479,55487,
8,890609185150312448,This is Zoey. She doesn't want to be one of the scary sharks. Just wants to be a snuggly pettable boatpet. 13/10 #BarkWeek https://t.co/9TwLuAGH0b,13.0,10.0,Zoey,1.3,2017-07-27,16:25:51,https://pbs.twimg.com/media/DFwUU__XcAEpyXI.jpg,Irish terrier,0.487574,3565,23875,
9,890240255349198849,This is Cassie. She is a college pup. Studying international doggo communication and stick theory. 14/10 so elegant much sophisticate https://t.co/t1bfwz5S2A,14.0,10.0,Cassie,1.4,2017-07-26,15:59:51,https://pbs.twimg.com/media/DFrEyVuW0AAO3t9.jpg,Pembroke,0.511319,5999,27230,doggo
10,890006608113172480,This is Koda. He is a South Australian deckshark. Deceptively deadly. Frighteningly majestic. 13/10 would risk a petting #BarkWeek https://t.co/dVPW0B0Mme,13.0,10.0,Koda,1.3,2017-07-26,00:31:25,https://pbs.twimg.com/media/DFnwSY4WAAAMliS.jpg,Samoyed,0.957979,6046,26345,
11,889880896479866881,This is Bruno. He is a service shark. Only gets out of the water to assist you. 13/10 terrifyingly good boy https://t.co/u1XPQMl29g,13.0,10.0,Bruno,1.3,2017-07-25,16:11:53,https://pbs.twimg.com/media/DFl99B1WsAITKsg.jpg,French bulldog,0.377417,4090,23899,
12,889665388333682689,Here's a puppo that seems to be on the fence about something haha no but seriously someone help her. 13/10 https://t.co/BxvuXk0UCm,13.0,10.0,,1.3,2017-07-25,01:55:32,https://pbs.twimg.com/media/DFi579UWsAAatzw.jpg,Pembroke,0.966327,8202,40979,puppo
13,889638837579907072,This is Ted. He does his best. Sometimes that's not enough. But it's ok. 12/10 would assist https://t.co/f8dEDcrKSR,12.0,10.0,Ted,1.2,2017-07-25,00:10:02,https://pbs.twimg.com/media/DFihzFfXsAYGDPR.jpg,French bulldog,0.99165,3659,23078,
14,889531135344209921,This is Stuart. He's sporting his favorite fanny pack. Secretly filled with bones only. 13/10 puppared puppo #BarkWeek https://t.co/y70o6h3isq,13.0,10.0,Stuart,1.3,2017-07-24,17:02:04,https://pbs.twimg.com/media/DFg_2PVW0AEHN3p.jpg,golden retriever,0.953442,1855,13008,puppo
15,889278841981685760,This is Oliver. You're witnessing one of his many brutal attacks. Seems to be playing with his victim. 13/10 fr*ckin frightening #BarkWeek https://t.co/WpHvrQedPb,13.0,10.0,Oliver,1.3,2017-07-24,00:19:32,https://pbs.twimg.com/ext_tw_video_thumb/889278779352338437/pu/img/VlbFB3v8H8VwzVNY.jpg,whippet,0.626152,4375,21506,
16,888917238123831296,This is Jim. He found a fren. Taught him how to sit like the good boys. 12/10 for both https://t.co/chxruIOUJN,12.0,10.0,Jim,1.2,2017-07-23,00:22:39,https://pbs.twimg.com/media/DFYRgsOUQAARGhO.jpg,golden retriever,0.714719,3697,24965,
17,888804989199671297,This is Zeke. He has a new stick. Very proud of it. Would like you to throw it for him without taking it. 13/10 would do my best https://t.co/HTQ77yNQ5K,13.0,10.0,Zeke,1.3,2017-07-22,16:56:37,https://pbs.twimg.com/media/DFWra-3VYAA2piG.jpg,golden retriever,0.46976,3468,21876,
18,888554962724278272,This is Ralphus. He's powering up. Attempting maximum borkdrive. 13/10 inspirational af https://t.co/YnYAFCTTiK,13.0,10.0,Ralphus,1.3,2017-07-22,00:23:06,https://pbs.twimg.com/media/DFTH_O-UQAACu20.jpg,Siberian husky,0.700377,2839,16881,
19,888078434458587136,This is Gerald. He was just told he didn't get the job he interviewed for. A h*ckin injustice. 12/10 didn't want the job anyway https://t.co/DK7iDPfuRX,12.0,10.0,Gerald,1.2,2017-07-20,16:49:33,https://pbs.twimg.com/media/DFMWn56WsAAkA7B.jpg,French bulldog,0.995026,2845,18629,
20,887705289381826560,This is Jeffrey. He has a monopoly on the pool noodles. Currently running a 'boop for two' midweek sale. 13/10 h*ckin strategic https://t.co/PhrUk20Q64,13.0,10.0,Jeffrey,1.3,2017-07-19,16:06:48,https://pbs.twimg.com/media/DFHDQBbXgAEqY7t.jpg,basset,0.821664,4454,25895,
21,887517139158093824,I've yet to rate a Venezuelan Hover Wiener. This is such an honor. 14/10 paw-inspiring af (IG: roxy.thedoxy) https://t.co/20VrLAA8ba,14.0,10.0,,1.4,2017-07-19,03:39:09,https://pbs.twimg.com/ext_tw_video_thumb/887517108413886465/pu/img/WanJKwssZj4VJvL9.jpg,,,9678,39604,
22,887473957103951883,This is Canela. She attempted some fancy porch pics. They were unsuccessful. 13/10 someone help her https://t.co/cLyzpcUcMX,13.0,10.0,Canela,1.3,2017-07-19,00:47:34,https://pbs.twimg.com/media/DFDw2tyUQAAAFke.jpg,Pembroke,0.809197,14784,58776,
23,887343217045368832,You may not have known you needed to see this today. 13/10 please enjoy (IG: emmylouroo) https://t.co/WZqNqygEyV,13.0,10.0,,1.3,2017-07-18,16:08:03,https://pbs.twimg.com/ext_tw_video_thumb/887343120832229379/pu/img/6HSuFrW1lzI_9Mht.jpg,Mexican hairless,0.330741,8642,28806,
24,887101392804085760,This... is a Jubilant Antarctic House Bear. We only rate dogs. Please only send dogs. Thank you... 12/10 would suffocate in floof https://t.co/4Ad1jzJSdp,12.0,10.0,,1.2,2017-07-18,00:07:08,https://pbs.twimg.com/media/DE-eAq6UwAA-jaE.jpg,Samoyed,0.733942,4906,26230,
25,886983233522544640,This is Maya. She's very shy. Rarely leaves her cup. 13/10 would find her an environment to thrive in https://t.co/I6oNy0CgiT,13.0,10.0,Maya,1.3,2017-07-17,16:17:36,https://pbs.twimg.com/media/DE8yicJW0AAAvBJ.jpg,Chihuahua,0.793469,6201,29624,
26,886736880519319552,"This is Mingus. He's a wonderful father to his smol pup. Confirmed 13/10, but he needs your help

https://t.co/bVi0Yr4Cff https://t.co/ISvKOSkd5b",13.0,10.0,Mingus,1.3,2017-07-16,23:58:41,https://pbs.twimg.com/media/DE5Se8FXcAAJFx4.jpg,kuvasz,0.309706,2583,10241,
27,886680336477933568,This is Derek. He's late for a dog meeting. 13/10 pet...al to the metal https://t.co/BCoWue0abA,13.0,10.0,Derek,1.3,2017-07-16,20:14:00,https://pbs.twimg.com/media/DE4fEDzWAAAyHMM.jpg,,,3676,19220,
28,886366144734445568,This is Roscoe. Another pupper fallen victim to spontaneous tongue ejections. Get the BlepiPen immediate. 12/10 deep breaths Roscoe https://t.co/RGE08MIJox,12.0,10.0,Roscoe,1.2,2017-07-15,23:25:31,https://pbs.twimg.com/media/DE0BTnQUwAApKEH.jpg,French bulldog,0.999201,2585,18057,pupper
29,886258384151887873,This is Waffles. His doggles are pupside down. Unsure how to fix. 13/10 someone assist Waffles https://t.co/xZDA9Qsq1O,13.0,10.0,Waffles,1.3,2017-07-15,16:17:19,https://pbs.twimg.com/media/DEyfTG4UMAE4aE9.jpg,pug,0.943575,5176,23890,
30,885984800019947520,Viewer discretion advised. This is Jimbo. He will rip ur finger right h*ckin off. Other dog clearly an accessory. 12/10 pls pet with caution https://t.co/BuveP0uMF1,12.0,10.0,Jimbo,1.2,2017-07-14,22:10:11,https://pbs.twimg.com/media/DEumeWWV0AA-Z61.jpg,Blenheim spaniel,0.972494,5519,27892,
31,885528943205470208,This is Maisey. She fell asleep mid-excavation. Happens to the best of us. 13/10 would pat noggin approvingly https://t.co/tp1kQ8i9JF,13.0,10.0,Maisey,1.3,2017-07-13,15:58:47,https://pbs.twimg.com/media/DEoH3yvXgAAzQtS.jpg,pug,0.369275,5241,30774,
32,885167619883638784,Here we have a corgi undercover as a malamute. Pawbably doing important investigative work. Zero control over tongue happenings. 13/10 https://t.co/44ItaMubBf,13.0,10.0,,1.3,2017-07-12,16:03:00,https://pbs.twimg.com/media/DEi_N9qXYAAgEEw.jpg,malamute,0.8124819999999999,3615,18736,
33,884925521741709313,"This is Earl. He found a hat. Nervous about what you think of it. 12/10 it's delightful, Earl https://t.co/MYJvdlNRVa",12.0,10.0,Earl,1.2,2017-07-12,00:01:00,https://pbs.twimg.com/media/DEfjEaNXkAAtPlj.jpg,Italian greyhound,0.259916,14753,65696,
34,884876753390489601,This is Lola. It's her first time outside. Must test the earth and taste the atmosphere. 13/10 you're doing great Lola https://t.co/74TKAUsLkO,13.0,10.0,Lola,1.3,2017-07-11,20:47:12,https://pbs.twimg.com/media/DEe2tZXXkAAwyX3.jpg,chow,0.822103,4584,23743,
35,884562892145688576,This is Kevin. He's just so happy. 13/10 what is your secret Kevin https://t.co/1r4MFCbCX5,13.0,10.0,Kevin,1.3,2017-07-11,00:00:02,https://pbs.twimg.com/media/DEaZQkfXUAEC7qB.jpg,pug,0.5464060000000001,3840,20757,
36,884441805382717440,"I present to you, Pup in Hat. Pup in Hat is great for all occasions. Extremely versatile. Compact as h*ck. 14/10 (IG: itselizabethgales) https://t.co/vvBOcC2VdC",14.0,10.0,,1.4,2017-07-10,15:58:53,https://pbs.twimg.com/media/DEYrIZwWsAA2Wo5.jpg,Pembroke,0.993225,4729,23216,
37,884162670584377345,Meet Yogi. He doesn't have any important dog meetings today he just enjoys looking his best at all times. 12/10 for dangerously dapper doggo https://t.co/YSI00BzTBZ,12.0,10.0,Yogi,1.2,2017-07-09,21:29:42,https://pbs.twimg.com/media/DEUtQbzW0AUTv_o.jpg,German shepherd,0.707046,2464,17450,doggo
38,883838122936631299,This is Noah. He can't believe someone made this mess. Got the vacuum out for you though. Offered to help clean pup. 12/10 super good boy https://t.co/V85xujjDDY,12.0,10.0,Noah,1.2,2017-07-09,00:00:04,https://pbs.twimg.com/media/DEQGFgAXUAAEvfi.jpg,Doberman,0.610946,2811,18634,
39,883482846933004288,"This is Bella. She hopes her smile made you smile. If not, she is also offering you her favorite monkey. 13.5/10 https://t.co/qjrljjt948",5.0,10.0,Bella,0.5,2017-07-08,00:28:19,https://pbs.twimg.com/media/DELC9dZXUAADqUk.jpg,golden retriever,0.943082,8115,39114,
40,883360690899218434,Meet Grizzwald. He may be the floofiest floofer I ever did see. Lost eyes saving a schoolbus from a volcano erpuption. 13/10 heroic as h*ck https://t.co/rf661IFEYP,13.0,10.0,Grizzwald,1.3,2017-07-07,16:22:55,https://pbs.twimg.com/media/DEJT3FeXoAAtwUy.jpg,chow,0.987997,3023,19413,floofer
41,883117836046086144,"Please only send dogs. We don't rate mechanics, no matter how h*ckin good. Thank you... 13/10 would sneak a pat https://t.co/Se5fZ9wp5E",13.0,10.0,,1.3,2017-07-07,00:17:54,https://pbs.twimg.com/media/DEF2-_hXoAAs62q.jpg,golden retriever,0.949562,5443,31677,
42,882992080364220416,This is Rusty. He wasn't ready for the first pic. Clearly puppared for the second. 13/10 confirmed great boy https://t.co/tyER0KpdXj,13.0,10.0,Rusty,1.3,2017-07-06,15:58:11,https://pbs.twimg.com/media/DEEEnIqXYAAiJh_.jpg,Eskimo dog,0.466778,3192,20458,
43,882762694511734784,This is Gus. He's quite the cheeky pupper. Already perfected the disinterested wink. 12/10 would let steal my girl https://t.co/D43I96SlVu,12.0,10.0,Gus,1.2,2017-07-06,00:46:41,https://pbs.twimg.com/media/DEAz_HHXsAA-p_z.jpg,Labrador retriever,0.85005,4033,24177,pupper
44,882627270321602560,This is Stanley. He has his first swim lesson today. Doggle straps adjusted. Ready to go. 13/10 Phelps is nervous (IG: stanleythe_corgi) https://t.co/Nx52PGwH94,13.0,10.0,Stanley,1.3,2017-07-05,15:48:34,https://pbs.twimg.com/media/DD-40X3WAAAJPU5.jpg,Pembroke,0.542982,4970,23962,
45,882268110199369728,This is Alfy. You're witnessing his first watermelon experience. I think it was a success. 13/10 happy 4th Alfy ðŸ‡ºðŸ‡¸ https://t.co/fYP5RlutfA,13.0,10.0,Alfy,1.3,2017-07-04,16:01:23,https://pbs.twimg.com/media/DD5yKdPW0AArzX8.jpg,golden retriever,0.762211,9451,38284,
46,882045870035918850,"This is Koko. Her owner, inspired by Barney, recently built a cart for her to use during walks if she got tired. 13/10 rest easy Koko https://t.co/zeDpnsKX7w",13.0,10.0,Koko,1.3,2017-07-04,01:18:17,https://pbs.twimg.com/media/DD2oCl2WAAEI_4a.jpg,golden retriever,0.00694063,4012,25036,
47,881906580714921986,This is Rey. He's a Benebop Cumberfloof. 12/10 dangerously pettable https://t.co/503CgWbhxQ,12.0,10.0,Rey,1.2,2017-07-03,16:04:48,https://pbs.twimg.com/media/DD0pWm9XcAAeSBL.jpg,Weimaraner,0.291539,2797,20873,
48,881666595344535552,This is Gary. He couldn't miss this puppertunity for a selfie. Flawless focusing skills. 13/10 would boop intensely https://t.co/7CSWCl8I6s,13.0,10.0,Gary,1.3,2017-07-03,00:11:11,https://pbs.twimg.com/media/DDxPFwbWAAEbVVR.jpg,Saluki,0.529012,8791,43354,
49,881536004380872706,"Here is a pupper approaching maximum borkdrive. Zooming at never before seen speeds. 14/10 paw-inspiring af 
(IG: puffie_the_chow) https://t.co/ghXBIIeQZF",14.0,10.0,,1.4,2017-07-02,15:32:16,https://pbs.twimg.com/ext_tw_video_thumb/881535971568889856/pu/img/9bawiZ--8FKywTkz.jpg,Samoyed,0.281463,13184,42308,pupper
50,881268444196462592,Meet Elliot. He's a Canadian Forrest Pup. Unusual number of antlers for a dog. Sneaky tongue slip to celebrate #Canada150. 12/10 would pet https://t.co/cgwJwowTMC,12.0,10.0,Elliot,1.2,2017-07-01,21:49:04,https://pbs.twimg.com/media/DDrk-f9WAAI-WQv.jpg,,,4411,19885,
51,880935762899988482,This is Louis. He's crossing. It's a big deal. 13/10 h*ckin breathtaking https://t.co/D0wb1GlKAt,13.0,10.0,Louis,1.3,2017-06-30,23:47:07,https://pbs.twimg.com/media/DDm2Z5aXUAEDS2u.jpg,,,2290,14616,
52,880872448815771648,Ugh not again. We only rate dogs. Please don't send in well-dressed  floppy-tongued street penguins. Dogs only please. Thank you... 12/10 https://t.co/WiAMbTkDPf,12.0,10.0,,1.2,2017-06-30,19:35:32,https://pbs.twimg.com/media/DDl8zzJW0AAisCJ.jpg,Pembroke,0.791416,3156,18234,
53,880465832366813184,This is Bella. She had her first beach experience this morning. Complete success. 12/10 would perform a sandy boop https://t.co/4VsFysDmiw,12.0,10.0,Bella,1.2,2017-06-29,16:39:47,https://pbs.twimg.com/media/DDgK-J4XUAIEV9W.jpg,golden retriever,0.913255,5133,24406,
54,880221127280381952,Meet Jesse. He's a Fetty Woof. His tongue ejects without warning. A true bleptomaniac. 12/10 would snug well https://t.co/fUod0tVmvK,12.0,10.0,Jesse,1.2,2017-06-29,00:27:25,https://pbs.twimg.com/media/DDcscbXU0AIfDzs.jpg,Chihuahua,0.238525,3414,23051,
55,880095782870896641,Please don't send in photos without dogs in them. We're not @porch_rates. Insubordinate and churlish. Pretty good porch tho 11/10 https://t.co/HauE8M3Bu4,11.0,10.0,,1.1,2017-06-28,16:09:20,https://pbs.twimg.com/media/DDa6ckbXgAAM1vV.jpg,miniature pinscher,0.120298,3588,23653,
56,879862464715927552,This is Romeo. He would like to do an entrance. Requesting your immediate assistance. 13/10 https://t.co/Qh5aEkRQm9,13.0,10.0,Romeo,1.3,2017-06-28,00:42:13,https://pbs.twimg.com/media/DDXmPrbWAAEKMvy.jpg,basset,0.813507,2878,19182,
57,879492040517615616,This is Bailey. He thinks you should measure ear length for signs of growth instead. 12/10 https://t.co/IxM9IMKQq8,12.0,10.0,Bailey,1.2,2017-06-27,00:10:17,https://pbs.twimg.com/media/DDSVWMvXsAEgmMK.jpg,German short-haired pointer,0.479896,2591,20138,
58,879415818425184262,This is Duddles. He did an attempt. 13/10 someone help him (vid by Georgia Felici) https://t.co/UDT7ZkcTgY,13.0,10.0,Duddles,1.3,2017-06-26,19:07:24,https://pbs.twimg.com/ext_tw_video_thumb/879415784908390401/pu/img/cX7XI1TnUsseGET5.jpg,English springer,0.383404,36795,90658,
59,879376492567855104,This is Jack AKA Stephen Furry. You're not scoring on him. Unless he slips down the slide. 12/10 would happily get blocked by https://t.co/0gOi601EAa,12.0,10.0,Jack,1.2,2017-06-26,16:31:08,https://pbs.twimg.com/media/DDQsQGFV0AAw6u9.jpg,Labrador retriever,0.0334961,2615,14472,
60,879050749262655488,This is Steven. He has trouble relating to other dogs. Quite shy. Neck longer than average. Tropical probably. 11/10 would still pet https://t.co/2mJCDEJWdD,11.0,10.0,Steven,1.1,2017-06-25,18:56:45,https://pbs.twimg.com/media/DDMD_phXoAQ1qf0.jpg,,,3880,19288,
61,879008229531029506,This is Beau. That is Beau's balloon. He takes it everywhere. 13/10 would protect at all costs https://t.co/YDtpCjIPKN,13.0,10.0,Beau,1.3,2017-06-25,16:07:47,https://pbs.twimg.com/media/DDLdUrqXYAMOVzY.jpg,vizsla,0.960513,2206,16323,
62,878776093423087618,This is Snoopy. He's a proud #PrideMonthPuppo. Impeccable handwriting for not having thumbs. 13/10 would love back #PrideMonth https://t.co/lNZwgNO4gS,13.0,10.0,Snoopy,1.3,2017-06-25,00:45:22,https://pbs.twimg.com/media/DDIKMXzW0AEibje.jpg,Italian greyhound,0.734684,3374,16631,puppo
63,878281511006478336,"Meet Shadow. In an attempt to reach maximum zooming borkdrive, he tore his ACL. Still 13/10 tho. Help him out below

https://t.co/245xJJElsY https://t.co/lUiQH219v6",13.0,10.0,Shadow,1.3,2017-06-23,16:00:04,https://pbs.twimg.com/media/DDBIX9QVYAAohGa.jpg,basset,0.32042,1054,6596,
64,878057613040115712,This is Emmy. She was adopted today. Massive round of pupplause for Emmy and her new family. 14/10 for all involved https://t.co/cwtWnHMVpe,14.0,10.0,Emmy,1.4,2017-06-23,01:10:23,https://pbs.twimg.com/media/DC98vABUIAA97pz.jpg,French bulldog,0.839097,5628,36013,
65,877736472329191424,This is Aja. She was just told she's a good dog. Suspicions confirmed. 13/10 would tell again https://t.co/lsPyyAiF1r,13.0,10.0,Aja,1.3,2017-06-22,03:54:17,https://pbs.twimg.com/media/DC5YqoQW0AArOLH.jpg,Chesapeake Bay retriever,0.8379559999999999,15539,67629,
66,877556246731214848,This is Penny. She's both pupset and fired pup. Not pleased w your barbaric attempts at cleanliness. 12/10 would enjoy more shampoo options https://t.co/OYdDlfOGXP,12.0,10.0,Penny,1.2,2017-06-21,15:58:08,https://pbs.twimg.com/media/DC20wEcW0AAf59m.jpg,basset,0.995368,3109,19373,
67,877316821321428993,"Meet Dante. At first he wasn't a fan of his new raincoat, then he saw his reflection. H*ckin handsome. 13/10 for water resistant good boy https://t.co/SHRTIo5pxc",13.0,10.0,Dante,1.3,2017-06-21,00:06:44,https://pbs.twimg.com/media/DCza_vtXkAQXGpC.jpg,Saluki,0.5099670000000001,4272,23544,
68,877201837425926144,This is Nelly. He graduated with his dogtorate today. Wants to know if you're proud of him. 12/10 would give congratulatory boop https://t.co/4g4cfj3P4Y,12.0,10.0,Nelly,1.2,2017-06-20,16:29:50,https://pbs.twimg.com/media/DCxyahJWsAAddSC.jpg,Pembroke,0.93112,4542,23258,
69,876838120628539392,This is Ginger. She's having a ruff Monday. Too many pupper things going on. H*ckin exhausting. 12/10 would snug passionately https://t.co/j211oCDRs6,12.0,10.0,Ginger,1.2,2017-06-19,16:24:33,https://pbs.twimg.com/media/DCsnnZsVwAEfkyi.jpg,bloodhound,0.575751,2763,17725,pupper
70,876484053909872640,This is Benedict. He wants to thank you for this delightful urban walk. Hopes you know he loves you. 13/10 super duper good boy https://t.co/26BXueUgbs,13.0,10.0,Benedict,1.3,2017-06-18,16:57:37,https://pbs.twimg.com/media/DCnll_dUQAAkBdG.jpg,golden retriever,0.874566,1964,16118,
71,876120275196170240,"Meet Venti, a seemingly caffeinated puppoccino. She was just informed the weekend would include walks, pats and scritches. 13/10 much excite https://t.co/ejExJFq3ek",13.0,10.0,Venti,1.3,2017-06-17,16:52:05,https://pbs.twimg.com/media/DCiavj_UwAAcXep.jpg,Bernese mountain dog,0.534327,3847,24004,
72,875747767867523072,"This is Goose. He's a womanizer. Cheeky as h*ck, but also deep. Tongue slip game on another level. 13/10 will steal your girl https://t.co/V2WlACRJCN",13.0,10.0,Goose,1.3,2017-06-16,16:11:53,https://pbs.twimg.com/media/DCdH8YpUQAAiEbL.jpg,Labrador retriever,0.799551,3519,21523,
73,875144289856114688,Meet Nugget and Hank. Nugget took Hank's bone. Hank is wondering if you would please return it to him. Both 13/10 would not intervene https://t.co/ogith9ejNj,13.0,10.0,Nugget,1.3,2017-06-15,00:13:52,https://pbs.twimg.com/ext_tw_video_thumb/875144175078957056/pu/img/BRi_l7vUdpb93Knf.jpg,Siberian husky,0.245048,4093,18915,
74,875021211251597312,Guys please stop sending pictures without any dogs in th- oh never mind hello excuse me sir. 12/10 stealthy as h*ck https://t.co/brCQoqc8AW,12.0,10.0,,1.2,2017-06-14,16:04:48,https://pbs.twimg.com/media/DCSzF3NVoAAPzT4.jpg,West Highland white terrier,0.7143189999999999,3900,21917,
75,874680097055178752,Meet Cash. He hath acquired a stick. A very good stick tbh. 12/10 would pat head approvingly https://t.co/lZhtizkURD,12.0,10.0,Cash,1.2,2017-06-13,17:29:20,https://pbs.twimg.com/media/DCN85nGUwAAzG_q.jpg,Labrador retriever,0.836052,3855,23887,
76,874296783580663808,This is Jed. He may be the fanciest pupper in the game right now. Knows it too. 13/10 would sign modeling contract https://t.co/0YplNnSMEm,13.0,10.0,Jed,1.3,2017-06-12,16:06:11,https://pbs.twimg.com/media/DCIgSR0XgAANEOY.jpg,cocker spaniel,0.437216,3419,22372,pupper
77,874057562936811520,"I can't believe this keeps happening. This, is a birb taking a bath. We only rate dogs. Please only send dogs. Thank you... 12/10 https://t.co/pwY9PQhtP2",12.0,10.0,,1.2,2017-06-12,00:15:36,https://pbs.twimg.com/media/DCFGtdoXkAEsqIw.jpg,flat-coated retriever,0.8321770000000001,3324,19489,
78,874012996292530176,"This is Sebastian. He can't see all the colors of the rainbow, but he can see that this flag makes his human happy. 13/10 #PrideMonth puppo https://t.co/XBE0evJZ6V",13.0,10.0,Sebastian,1.3,2017-06-11,21:18:31,https://pbs.twimg.com/media/DCEeLxjXsAAvNSM.jpg,Cardigan,0.806674,8443,29316,puppo
79,873580283840344065,"We usually don't rate Deck-bound Saskatoon Black Bears, but this one is h*ckin flawless. Sneaky tongue slip too. 13/10 would hug firmly https://t.co/mNuMH9400n",13.0,10.0,,1.3,2017-06-10,16:39:04,https://pbs.twimg.com/media/DB-UotKXkAEHXVi.jpg,Newfoundland,0.678537,3283,20792,
80,873213775632977920,"This is Sierra. She's one precious pupper. Absolute 12/10. Been in and out of ICU her whole life. Help Sierra below

https://t.co/Xp01EU3qyD https://t.co/V5lkvrGLdQ",12.0,10.0,Sierra,1.2,2017-06-09,16:22:42,https://pbs.twimg.com/media/DB5HTBGXUAE0TiK.jpg,vizsla,0.6197819999999999,1310,6164,pupper
81,872967104147763200,Here's a very large dog. He has a date later. Politely asked this water person to check if his breath is bad. 12/10 good to go doggo https://t.co/EMYIdoblMR,12.0,10.0,,1.2,2017-06-09,00:02:31,https://pbs.twimg.com/media/DB1m871XUAAw5vZ.jpg,Labrador retriever,0.476913,4487,23468,doggo
82,872820683541237760,"Here are my favorite #dogsatpollingstations 
Most voted for a more consistent walking schedule and to increase daily pats tenfold. All 13/10 https://t.co/17FVMl4VZ5",13.0,10.0,,1.3,2017-06-08,14:20:41,https://pbs.twimg.com/media/DBzhx0PWAAEhl0E.jpg,pug,0.99912,3112,12745,
83,872620804844003328,This is Monkey. She's supporting owners everywhere with her fancy #PrideMonth bandana. 13/10 love is love is love... https://t.co/lUcpnZDPz9,13.0,10.0,Monkey,1.3,2017-06-08,01:06:27,https://pbs.twimg.com/media/DBwr_hzXkAEnZBW.jpg,cocker spaniel,0.513191,3011,17773,
84,872486979161796608,We. Only. Rate. Dogs. Do not send in other things like this fluffy floor shark clearly ready to attack. Get it together guys... 12/10 https://t.co/BZHiKx3FpQ,12.0,10.0,,1.2,2017-06-07,16:14:40,https://pbs.twimg.com/media/DBuyRlTUwAAYhG9.jpg,Pembroke,0.931861,7554,35083,
85,872122724285648897,This is Kody. He's a baller. Wishes he was a little bit taller. Double dribbles often. Still 12/10 would happily get dunked on https://t.co/PKSpmiefwN,12.0,10.0,Kody,1.2,2017-06-06,16:07:15,https://pbs.twimg.com/media/DBpm-5UXcAUeCru.jpg,pug,0.06673630000000001,6708,29464,
86,871879754684805121,Say hello to Lassie. She's celebrating #PrideMonth by being a splendid mix of astute and adorable. Proudly supupporting her owner. 13/10 https://t.co/uK6PNyeh9w,13.0,10.0,Lassie,1.3,2017-06-06,00:01:46,https://pbs.twimg.com/media/DBmKAmBXUAE-pQ-.jpg,Shetland sheepdog,0.969171,9101,32220,
87,871762521631449091,This is Rover. As part of pupper protocol he had to at least attempt to eat the plant. Confirmed not tasty. Needs peanut butter. 12/10 https://t.co/AiVljI6QCg,12.0,10.0,Rover,1.2,2017-06-05,16:15:56,https://pbs.twimg.com/media/DBkfY58XcAEdzZy.jpg,Labrador retriever,0.921393,2920,17397,pupper
88,871515927908634625,This is Napolean. He's a Raggedy East Nicaraguan Zoom Zoom. Runs on one leg. Built for deception. No eyes. Good with kids. 12/10 great doggo https://t.co/PR7B7w1rUw,12.0,10.0,Napolean,1.2,2017-06-04,23:56:03,https://pbs.twimg.com/media/DBg_HT9WAAEeIMM.jpg,komondor,0.974781,2887,17422,doggo
